,text
3907,100 1 mix new flat double side linerless bottle cap choose mix flatten full reû httptcow00kjprfdr httptcomixl1pfrje
3908,bigburgerboi55 flat football like flattened spartan crush back day hail
3909,satanaofhell ever see far dreamy look come face ear flatten started walk slowly toward youd
3910,100 1 mix new flat double side linerless bottle cap choose mix flatten full reû httptcowrnpywyalj httptcoqv7iydovx9
3911,fizzy sit regular flood seat one know
3912,jkl cancel flash flood warning bell harlan knox ky httptco4ry6zhcpoq wx
3913,spot flood combo 53inch 300w curve cree lead work light bar 4x4 offroad fog lamp full reû httptcoxxkhjysn0p httptcojevhknjgbx
3914,spot flood combo 53inch 300w curve cree lead work light bar 4x4 offroad fog lamp full reû httptcojcdd6sd6qn httptco9guckjghms
3915,small flood bigåêconsequences httpstcocvpdvhxd1r httptcofdmxp4fcmo
3916,homecoming queen kill way home prom flood water socialnews httptcovmkexjtyg4
3917,2pcs 18w cree lead work light offroad lamp car truck boat mining 4wd flood beam full reaû httptcovdefmulx43 httptcoyqpaijsa5g
3918,rain since leave im drown flood see ive always fighter without give
3919,creationmin rwrabbit gooneratheist atheistic1 lolatjesus yet still many fish die worldwide flood wonder
3920,please dont flood poor robertbenglunds mention he put work
3921,spot flood combo 53inch 300w curve cree lead work light bar 4x4 offroad fog lamp full reû httptcomtmoia0oo0 httptconn4ztcmsru
3922,atlarnxx didnt
3923,12 72w cree lead work light bar alloy spot flood combo dive offroad 4wd boat full readû httptcoxwn7rgvkzc httptcoswpdq84boi
3924,2pcs 18w cree lead work light offroad lamp car truck boat mining 4wd flood beam full reaû httptcoapwxs5mm44 httptcods76lozlsu
3925,hellotybeeren cue flood people ironically call
3926,motor hot deal 452 gtgt httptcoed32pbvio7 10x 27w 12v 24v led work light flood lamp tractor truck suv utv aû httptcoifm6v6480p
3927,85v265v 10w lead warm white light motion sensor outdoor flood light pir lamp auc httptconjvpxzmj5v httptcoijd7wzv5t9
3928,iembothfo 1000 2 nnw hana maui co hi county official report coastal flood û httptcogg0dzsvbz7 httptcokbe91arcdw
3929,1 pair new 27w 4 round lead work drive flood light offroad atv utv full read ebay httptcod3p88xdlec httptcoj2ddvh7fy0
3930,2pcs 18w cree lead work light offroad lamp car truck boat mining 4wd flood beam full reaû httptcoo1smuh2unn httptcoxqj6wgiuqh
3931,internet basic flood defective intertissue soul mate milk trench host guabxfv httptcouzsqzycb8x
3932,bmx issue areal flood advisory shelby al till aug 5 900 pm cdt httptco62oddekvli
3933,2pcs 18w cree lead work light offroad lamp car truck boat mining 4wd flood beam full reaû httptco1qt51r5h98 httptcooqh1jbuenl
3934,flood advisory effect shelby county al 9 pm alwx httptcogtqmgsgcsb
3935,rt grantfactory grant fund weymouth meeting seawall flood grant set thursday night û httptcoth2wlilbmo
3936,spot flood combo 53inch 300w curve cree lead work light bar 4x4 offroad fog lamp full reû httptco5xmce6jufs httptco3zo7px3p1v
3937,spot flood combo 53inch 300w curve cree lead work light bar 4x4 offroad fog lamp full reû httptcoo097vsotxk httptcoi23xy7iejj
3938,spot flood combo 53inch 300w curve cree lead work light bar 4x4 offroad fog lamp full reû httptcofdsaooiskj httptco2uvmq4vafq
3939,flood advisory issue august 05 428pm edt nw httptcod02sbm0ojs wxky
3940,survive plague float flood peek head mud one immune deafen bell god survive
3941,spot flood combo 53inch 300w curve cree lead work light bar 4x4 offroad fog lamp full reû httptco6zcfhi7srw httptcovwykdau1vm
3942,flood prone waterways westchester county eligible million state aid newyork httptcoxsr2vujyiz
3943,chinese rescue team arrive myanmar help flood victim httptconosvu0zx4x sittway httptco5mjzjnkpfn
3944,flood advisory issue august 05 710pm cdt august 05 800pm cdt nws urban httptcosemw5cq7dg weather
3945,12 72w cree lead work light bar alloy spot flood combo dive offroad 4wd boat full readû httptcomjmwa72er6 httptcoadx9iyi246
3946,rock spring ûò resident live elk street continue battle flood issue mondayûªs rain storm whileû httptco8j19fvu7qa
3947,cuban leader extend sympathy vietnam flood httptcoxlq8g6vb2r
3948,business sponge dock wash rain flooding httptco5pmikavykl
3949,warlordqueen thrust little jams cock deep inside flood womb pussy hot thick cum
3950,severe thunderstorm flash flood possible midsouth midwest httptcouahicwpih4 weather environment climate nature
3951,1130a radar update widespread showersstorms move areasminor flood possible hunwx httptcoe3l1jqjh2u
3952,tip prevent basement leak create control joint eliminate random crack homeimprovement flooding httptcokx8cu4s8t1
3953,flood httptcowveo9ed10e
3954,adorableappple report flooding po area ten4 mmda
3955,flood kill 166 displace one million pakistan daily news amp analysis httptco9mj8ouj3vt yugvani
3956,flood kill 166 displace one million pakistan daily news amp analysis httptcokkoovbkndp
3957,lao flood 10 village underwater world vision respond httptco8fvqrizoux
3958,flood ukfloods british trekker rescue amid flash flood himalayas group british tr httptconsfzkfgznj flooding
3959,slopeofhope maybe plan dilute safely say start charge longs would come flooding
3960,cuban leader extend sympathy vietnam flood httptcoqcyxwr2rdv
3961,ill dm hotel info people flood notification ask info
3962,wave flood shore cant find way home anymore thats look httptcotdaktglu5p
3963,flood occurs home stop mold growth via proudgreenhome httptcokavaovjz2v
3964,httptcoxjkrxrnwnv flood track cause derailment sa insubcontinent insubcontinent httptcojlwgshyy3n
3965,chinese flood nyc market like never httptco9z9hsmiavd
3966,obama keep 27 iraqi christian asylum seeker ndetention flood us wunscreened muslim httptcob4k0r4gga8 via dcclothesline
3967,grateful support flood netkicorp dinner guest thank httpstcoeltne5v1qn
3968,flash flood madison valleywx
3969,themaine soon start flooding comment section come brazil comment bc
3970,last year lot drums flood janice im fall
3971,ûïbbcengland burst water main cause major flood birmingham hospital httptcoq4kgftc2am httptco6w6a2l4qaeû omg
3972,heavy rainfall flood northern vietnam situation report no2 httptcohvxu1zcvau httptcoijmccmhh5g
3973,crabbycale oh god memory flood back
3974,flood disaster burst water pipe flood apartment nycha senior center ny1 ny1burst water pipe flood httptcow7siidujoh
3975,lrt look tom feel flood back
3976,myanmar msf assist thousand bad flood decade hit part myanmar httptcopijg5w2l2u
3977,resident central part ocean city heard engineer flood mitigation option tuesday ocnj httptcojzprciqa9d
3978,wen finally get girl want im flood yall wit pic us rs tho
3979,kwislo see flood mad decent
3980,monsoon flood kill dozen myanmar prompt call help httptcor7vpaklhvi
3981,memorial unveil travis county deputy kill sept flooding travis county sheriff greg hamilton joinedû httptcoeo2f96wxpz
3982,flood kill 166 displace one million pakistan httptcoicfql7i9op least 166 people kill nearly 11 lakhû
3983,thankkk u soo much flooding notificationsu fella parsholics r superb amp jus soo awesomelove love u always frvrgrateful
3984,slip slide away flash flood info writer wtony nester sonoranrattler writingtips httptcoslttorrlhs
3985,bring tornado flood bring climate change god america plague farrakhan quote
3986,myanmar flood heavy monsoon rain month july cause flooding flash flood landsli httptco9tg7a5oqfp
3987,india 119000 people take shelter 966 relief camps government set flood httptcoeu8jypizsd
3988,pmharper dont worry im sure climate nothing hail flood tornados alberta amp ontario im sure god mad
3989,ictyosaur never think would wtf moment yet month 90 degree heat next flash flood
3990,grant like half town flood rain still whatever
3991,madonnamking rspca site multiple 7 story high rise building next low density character residential area flood
3992,cyberdemon531 hope mountain dew erode throat flood lung leave drown death
3993,disaster group stun flood httptcojrgj17oamt
3994,there person amp reckon youre die brain flood dmt cause relive life real time simulation
3995,ever remember old song something havent hear year word carry flood memory along priceless
3996,flood fish finally sunshine amp fab deal albertsons anniversary sale lauren paint beautiful life httptcocwhslmb8x9
3997,flood disaster bengal flood cm mamata banerjee blame dvc bjp claim state fail use economic httptcobozlwr716z
3998,69 dead due flood myanmar naypyidaw aug 5 prensa latina death toll rise today 69 myanmar httptcojods9a32pi
3999,typhoon soudelor approach 7 kill 2 miss flood philippine httptconjmidysxof via abc7chicago
4000,casewrites rain nj flash flood otherwise desert grief tax
4001,download itunes httptcoocojppnrh1 flood glory luiz santos jazz art music
4002,contactenergy yep flood 1999 2000 clyde dam release every bit water could speccy ev charge way
4003,bamenda flood kill animal bird httptcownamtxlfmt httptco6coidv11qv
4004,hope rain throughout whole weekend hope flood portaloos become sentient
4005,apc chieftain task dickson n15b flood donation bayelsa httptcolqgoe7psxp
4006,pagasa 712am yellow warning panay island guimaras negros possible flood lowlying area amp landslide mountainous area
4007,rt 40hourfamine bangladesh government declare flood emergency worldvision continue mû httptcoxqdvghz8g6
4008,nearly 50 thousand people affect flood paraguay httptcoaw23wxtyjb httptcoabgct9vfua
4009,etp bengal flood cm mamata banerjee blame dvc bjp claim state fail use relief fund even flood w httptcohszjafxrvi
4010,may allah help suffer pakistan flood family dua
4011,child myanmar face double catastrophe flood hit httptco0jfnvaxfph
4012,love drake flood instagram make feel real tune everything like sumn
4013,bring tornado flood bring climate change god america plague farrakhan quote
4014,69 die myanmar flood 250000 affect httptcolxjjgyv86a httpstcou9x3perxco
4015,typhoon soudelor approach 7 kill 2 miss flood philippinesû httptco8rdxcfgqem typhoon
4016,memphis always flood
4017,flood cause damage death across asia medium content httptcoa2myutpdiq 05082015 httptcoxrskt0s9lz
4018,gtas soon maintenance end everyone flood server gtservers destroy extreme load gtmaintenance start anew
4019,bring tornado flood bring climate change god america plague farrakhan quote
4020,e112 particulatebreak solid combust fossil fuel voltaic active forest fire biological vocpetroleum ch4 bacteria decomposition
4021,careful anyone live west beaverton forest grove rapidly spread fire heading east
4022,add video youtube playlist httptcobcjylerryx ori bind forest ep 6 fire death
4023,one careless match start forest fire take whole box start campfire
4024,little forest fire warden httptcoaprensss3x
4025,fire pisgah national forest grow 375 acre httptcod7zxz42qw1
4026,ashenforest floorburnt manzanita amp timber johnson fire along ridge forest road 1 routecomplex httptcofymp4i2wp5
4027,sweet2young run set forest fire bite shit neck
4028,hornybigbadwolf set forest fire
4029,like youtube video httptcojk7npdpwro j cole fire squad 2014 forest hill drive
4030,view smoke column rise south end blake fire along forest road 1 routecomplex httptcoyqg5pvw5gx
4031,start forest fire cannot put httptco3stfmn26r9
4032,fire pisgah national forest grow 375 acre httptcodao9azeucr
4033,grill school function one grill go pretty much either forest fire inbetween make work
4034,515p watch forest fire smoke lift nuff fme tmake run tthe pet store hwy n ill bhome 7p
4035,forest fire socal fire watch ybtheprophet realhiphop httpstcozpsnx5iyaj
4036,us forest service firefighter david ruhl 38 die frog fire modoc national forest temporarily reassign
4037,usfs acronym united state fire service httptco8nadrgr4xc
4038,one careless match start forest fire take whole box start campfire
4039,prevent forest fire httptcorgyuakc0dr
4040,naturaldisasters california fire rage forest service sound alarm rise wildfire cost û httptcotqwrw3jqwo
4041,q duck big flat foot stamp forest fire q elephant big flat foot stamp flame duck
4042,gilmanrocks7 wow rest summer usually worry forest fire calgary 8 hour away
4043,california fire rage forest service sound alarm sharply rise wildfire cost httptcodfyrppzkpu httptcoiwsdbgd1zq
4044,little concerned number forest fire ill live
4045,nycdivorcelaw trump climate denier algae bloom pacific calif alska seeweed caribean forest fire snowball inhofe
4046,forest service spends gt50 budget fighting fire httptcosrslcxhc2t
4047,cartoon bear without would qave knowlddge forest fire toilet paper
4048,first year forest service spend half annual budget fighting fire climatechange httptcod62zfzy0mi
4049,california fire rage forest service sound alarm rise wildfire cost httptcotft1bb4xaz
4050,reddit httptcoutumvaabz6 lightning spark new fire boise national forest rstormcoming
4051,spread conflict palmoil spark increase fire destroy forest throughout indonesia httptco4zn0mdsrvp
4052,photo blue forestfires source httptcoawxr24zsqh httptcoo9a26fn27y
4053,im cook smokey bear save forest fire face as httpstcowtggqs5geh
4054,forest fire amp die salmon time 2 act deny climate change nightmares httptcorbzomwgjee bcpoli canpoli vanpoli
4055,tale tree deep water love lake tahoe forest fire httpstcoxuhmj098lq
4056,852015 430 pm progress make boise forest fire httptco6o1mgmghgt httptcowtpo6elrzd
4057,group florida forest service firefighter could deploy california help contain fire detail 10 httptcofwup9yurzy
4058,pray east coast forest fire pray put pray rain
4059,bluejays brave angel instead dump water please send british columbia help forest fire
4060,heartdisease us forest service say spending half budget fire httptcokzfigkeeva
4061,pharrell prevent forest fire
4062,climate consequence us forest service say spending half budget fire httptcok0qtl8aodh httptcozqbxe7x9y7
4063,us forest service say spending half budget fire httptco1hlvrkwgip
4064,property loss northern california wildfire nearly double httptcootfw5sekd7 via yahoonews
4065,inciweb update rogue riversiskiyou national forest fire 8515 1200 pm rogue riversiskiyou nf areaû httptcolkwxu8qv7n
4066,forest fire could delay abbyairshow official say could good thing httptcovxjcx8ukmd
4067,us forest service say spending half budget fire ian simpsonû httptcouyyyrkd6q3
4068,campsite recommendation toilet shower pub fire kid pizza shop forest pretty stream midge snake thanks
4069,ur friend u talk forest fire forest tell u drop ur mix tape straightfire
4070,firefighting consumes forest service budget spark political clash forest service report cite increase cost ofû httptcolswsitnkuk
4071,great michigan technique camp b1g thanks bmurph1019 hailyoutsey termn8r13 goblue wrestleon httptcooaskgki6qj
4072,np avenge sevenfold hail king
4073,hail shadow hybrid mix feat mike szuter httptco9e2f7bivle youtube youtube
4074,tremblayeh like big hail cannot lie sirmixalot
4075,lzk issue severe thunderstorm warn wind 60 mph hail 075 sharp ar till 815 pm cdt httptcoauxsmdg1un wx
4076,two great dawgs dak jak hail state httptcoigyu2peiu3
4077,strong thunderstorm 4 mile north japton move se 25 mph large hail wind gusts 50 mph po arwx httptcotim8x9bi0f
4078,rnk issue severe thunderstorm warn wind 60 mph hail 100 rockingham stokes nc till aug 5 1000 pm edt û
4079,thank much everyone post rain hail outside idea guy
4080,chojo everyone hail pumpkin king
4081,cue storm massive wind hail power outage wxii davidson county
4082,heyseto enjoy hopefully epic hail storm go
4083,strong thunderstorm 4 mile north japton move se 25 mph large hail wind gusts 50 mph po arwx httptcoblppzaiboe
4084,hail lady cheryl 24 reason obsess cheryl cole httptcokigy7m6bgj
4085,kmactwn meaganerd look like bowl weather cereal new kellogg sugar hail stay crunchy even milk
4086,hail mary full grace lord thee bless art thou among woman bless fruit thy httptcoidqcfjycym
4087,see fahlowcw hail queenåê httptcoolpbmy9xw9 mtvhottest justin bieber httptcoon18cqgcoa
4088,modnao23 hail ruin everything plus car havent even get yet yet another killer migraine lose glass
4089,fazerain hail cloud
4090,new warn central hill 1 hail 60 mph wind affect sturgis could later tonight kotaweather httptco1epiyenqyl
4091,hailzel man kno im
4092,hail pic ûó httpstcob7omj7u3ei
4093,heavy rain lightning overhead oakridge sw calgary least melt hailyycstorm abstorm
4094,heyitsepark heavy rain hail
4095,weathernetwork come hail
4096,flow397 come atcha boston golfball size hail yesterday sunny amazing sky today parkchat
4097,central mass fruit tree escape heavy damage wind hail httptcovbffodtp6m
4098,new warn central hill 1 hail 60 mph wind affect sturgis could later tonight kotaweather httptcoqo3vwfelkp
4099,unr continue severe thunderstorm warn wind 60 mph hail lt75 weston wy custer fall river pennington sd till 715 pû
4100,kevin tan say hail chef û green pasture feature sustainable organic cooking httptcod9xvuvp9s6
4101,hail new caesar httptcogzmoblsjxu httptco5cgtqfk2ur
4102,calgary pound hail second day storm httpstco2be7bwcmpl
4103,darkndtatted pull holmes
4104,hire doppler show storm ne edmond severe 125 hail 60mph wind possible okwx httptcolrx0sdsnhm
4105,unr issue severe thunderstorm warn wind 60 mph hail 075 weston wy custer fall river lawrence meade pennington sû
4106,well much outdoor postering calgaryfringe mothernature hailstorm rain yycfringe killhard
4107,haleywhaley hailstorm hey secret trick get 375000 gem clash ofclans check profile
4108,nice job calgary transit httptcorgoguyt0lf
4109,freak boston hailstorm produce hailstorm business autobody repair specialist peterhowenecn 630830 tonight necn
4110,omg nixon live richard nixon tricky dicky right picture isnt hide calgary httptcomiusvpxqte
4111,hailthe user summons hailstorm last five turn damage pokemon except ice type
4112,calgary news weather traffic august 5 90 httptcoqbdryxsglc httptcovzod7qfflv
4113,adriasimon hailstorm day 2 round2 yyc yycstorm httptcofqqi8gvlq4
4114,wicked weather roll calgary surround area httptcosxwjyr3k3l httptcoaewglvqreh
4115,gotta love summer calgary yyc hailstorm crazyweather httptcoxqbwnlbbiu
4116,severe weather rare hailstorm pummel boston httptcojkym9edofc
4117,free hailstorm maxi httptcoerws6ieldg
4118,swear defend proven friend house hailstorm
4119,twin storm blow calgary 1 httptcorzagdnwtah httptcouqettagscu
4120,summer heat drive bobcats calgary backyard 35 httptcotmzxopvs94 httptcow192wkog1m
4121,ready close errrr nope notgoingoutinthat hailstorm alberta hellonwheelsamc howfans talkinghell httptco9giaxd6jty
4122,ig httptco2wbivkzjip hail abstorm yyc hail hailstorm haildamage yycweather calgary captureyyc alberta stoû
4123,summer heat drive bobcats calgary backyard 3 httptcokestuuyc4t httptcopzfbb1p1mj
4124,sadly tent fly survive hailstorm tear roof water tent httptcozct5cchoj0
4125,boston yesterday intense hailstorm xpost rcityporn 4608ìñ2474 û httptco8e6xuhrbkh httptcoqo190n8udd
4126,favorite text httptco5u5gakx2ch
4127,canada hailstorm flash flood slam calgary knock power 20k customer httptcosky9eokggb httptco5iyzsda6xb
4128,youre gonna take break work gotta right carlilescanoelivery lovemyjob httptcozo8rsqura2
4129,severe hailstorm progress northeast logan county cowx httptcoxk9owgv1o5
4130,councilscc say hailstorm
4131,scar leave car tree storm jamaicaplain boston hailstormû httpstcomj8rezoxlj
4132,calgary news weather traffic august 5 45 httptcozagbmlsf4h httptcohvyxehxbmq
4133,stephen ave flower pot get little ripped hailstorm today yyc abstorm calgary iamdowntown httptcohbhx0dwkpc
4134,grow calgary avoids bad city wicked weather 16 httptcohlyhdfwsqb httptcogwsnbmmcqf
4135,photo scar leave car tree storm jamaicaplain boston hailstorm httptco1fhrrhcimh
4136,calgary transit review policy leave hundred commuter strand hailû httptcoft7orfa52y httptcodv4mmlso1i
4137,600 passenger abandon lrt station tuesday hailstorm httptcovgf41iupkn yyc yycstorm abstorm
4138,quality metric penalty may harm patient care pcp say primary care physician generally hold positive vi httptcotdwprvb04y
4139,tareksocal think lot celebrity treat ppl could harm
4140,stick stone may break bone word never harm
4141,s2g anyone try harm cupcake ill fuck hunt end earth harrybecareful
4142,vanderbilt first harm httptcoccdx7cglqw
4143,leedsrouge love pick play worth fifth harmkid ink listen amp vote httptco0wratka2jl
4144,imagine doctor treat ebola patient without ever place harm way httptcodlizfkk30y
4145,right youre annoy actually hung youd see mean harm audaciousspunk
4146,ive burn self harm way im dumbass shouldnt allow around fire way
4147,concur longer spend child harm mmk httpstcodxwfx56pwh
4148,people keep tag self harm fucking
4149,dinallyhot love pick play worth fifth harmkid ink listen amp vote httptco0wratka2jl
4150,dont pray harm member isisi pray experience liferebooting love god amp become pauls god mindblowing final act
4151,safety improvement make route 198 buffalo harm good httptcorqlpsaye3b
4152,inner man wayward route harm spend replace online survey qzloremft
4153,anything happen fuck fly 2 metlife 3 hour away meampbeat crap any1 try 2 harm boy otratmetlife
4154,never escape bullet dont harm nothing harm know pain know pain sometimes share someone like
4155,standardized test harm child color httptcoid667rlets via parentsacrossam cc billgates
4156,ûïfor know plan youû declares lord ûïplans prosper harm plan httptcocirtvml9vp
4157,laurenmiller7 wont harm
4158,angelstar39 obama feel responsible bringing illegals family well protected harm feel heart 4 others
4159,ive meaning harm best way see fit
4160,vilelunar trickshot regular controller fuck infinite fading harm gt
4161,sex worker say credit card ban online ad harm good httptcob9zx2xz6aw
4162,someone harm angel httpstcovgzgok5k3s
4163,anyone harm boy would get take immediately security fan real quick
4164,many security gards good dare let someone harm harry otrametlife
4165,someone reblogged picture self harm scar oh please 2015 stop
4166,wowsavannah whats harm theyre collectible
4167,interview actor randy irwin ask could harm httptcok14q8chwkp
4168,5hvzlaradio love pick play worth fifth harmkid ink listen amp vote httptco0wratka2jl
4169,get world bros dont wanna see harm come way ima lil upset right
4170,wwexdreamer talk please dont harm self way shape form please care saw u right u well
4171,malistkiss sunni continue believe righteous continually harm shia defeat ideal islam
4172,news4buffalo yes lot harm good guardrail cant go 50 big problem school start
4173,spacewolverine harm foul somebody need say
4174,tastemycupcakee lmfaooo hell nawh yo as think
4175,self harm im angry please tag scar tumblr jesus christ dont wanna get trigger
4176,rjg0789 idki feel like movie do harm good make us look sterotypical annddd colorism prevalent sort
4177,quality metric penalty may harm patient care pcp say primary care physician generally hold positive view httptco0w12pwpsfx
4178,politician use false allegation attack plannedparenthood amp harm woman arent fooled standwithpp httptcoeqdm2opybg
4179,classycolkett thorgan hazard make move permanent go gladbach summer lmao
4180,lifestyle û÷it make sickûª baby clothes deem û÷hazardûª httptco0xrfvidxa2 httptcooihwgezdck
4181,longbreastyat yeah dont think he elite either think hazard well player much
4182,choke hazard prompt recall kraft cheese single httptconjlqrqcnl9
4183,see hazard without beard like httptcoipfzwwnxxp
4184,get hazard pay
4185,like youtube video chaboyyhd httptcoyr67ugesrm battlefield 4 funny moment dukes hazard undercover soldier
4186,phiddleface there choke hazard dont die get
4187,road hazard cascade rd sw childress dr sw httptcodilyvrowyj
4188,road closure remain effect due hazard tree fall tree torch uphill run fire forest service road 1 remains close
4189,di maria leave dear mufc back hazarddi maria argument id say hazard way well idc
4190,daviss drug guide nurse judith hopfer deglin april hazard vallerand httptcoiufs7uv1hk httptcoafrhnlly8d
4191,eden hazard hockey httpstcorbbnjkoqud
4192,confirm sanchez hazard bolasie rest season httpstco7ct01neptl
4193,thatpersianguy youngsafe eden hazard harden spot flop identical
4194,rate hazard highly fanboys among bad account twitter
4195,dannyraynard bad personally id get rid either hazard aguero well striker berahino
4196,choke hazard prompt recall kraft cheese single httptcoxgkyvf9t4f
4197,break arsenal hector bellerin arrest question regard disappearance eden hazardû httptcoecmj18azai
4198,freak accident sure look someone blame maybe remember player break leg cuz cart back end zone common sense
4199,december 2011 court dismiss group charge rape victim say get rap occupational hazard us military isi
4200,9503 bmw 528 530 540 740 emergency warn hazard switch button oem 20177707d httptcokvnahthuwz httptcoy8xknpqmnj
4201,kenya news chelsea talisman eden hazard keen match cristiano ronaldo lionel messi mipasho httptcolxvlqvbc8r
4202,big lead hazard new england history yeah let nail guy httpstcoxzvmzqus0x
4203,deaddreamer15 fire thatd safety hazard
4204,precious cargo onesie recall choke hazard httptco0pamznyyuw
4205,tomdean86 he alright hazardwillian aint gonna shift easily
4206,862015132 pm hazard high traffic area 5000 dean bridge rd httptcoitzzkwfhg5
4207,battlefield 4 funny moment dukes hazard undercover soldier mav httpstcoju8nfpnedl via youtube
4208,londonfire hi email people use report sthing think fire hazarddangerous
4209,tipster preview chelsea v swansea amp theres 481 double httptcopfsryjs1pc chelsea hazard httptcoskdbot7tgf
4210,arianagrande girl still lickin public donut health hazardu jail
4211,fair enough two best attack winger prem hazard willian basically start every game 100
4212,862015108 pm hazard high traffic area 1500 wrightsboro rd httptcodduxthvvnr
