,text
5476,reddit quarantine offensive content httptcocnshlnjuqx
5477,reddit quarantine offensiveåêcontent httptcovygh2ni4ah
5478,hermancranston wire reddit quarantine offensive content httptcowvn6griypq httptcorei3puwp84û û
5479,reddit quarantine offensive content reddit cofounder ceo steve huffman unveil specif httptcoljmgdpdlvs
5480,reddit quarantine offensive content reddit cofounder ceo steve huffman unveil specif httptcopmcp8czpnd
5481,wired business reddit quarantine offensive content httptcozhzvprzbgq
5482,rt wire reddit quarantine offensive content httptcozlagv1u5za
5483,reddit quarantine offensive content httptcofeikc9fxed onlinecommunities reddit via wire
5484,wire reddit quarantine offensive content reddit cofounder ceo steve huffman unveil sp httptcoabyhrgss1s
5485,missambear tweet quote wire httptcoe90j3vjolc
5486,yet another company try censor internet reddit start quarantine content httptcopg4y3i5ciu cc
5487,reddit quarantine offensive content reddit cofounder ceo steve huffman unveil specif httptcotdeukjzzii
5488,reddit quarantine offensiveû httptcowjwyjbncat onlinecommunities reddit amageddon freespeech httptco0erisq25kt
5489,reddit quarantine offensive content reddit cofounder ceo steve huffman unveil specif httptcot7ge0j3cay
5490,reddit quarantine offensive content httptconas3ipm5vh
5491,reddit quarantine offensive content httptcounnx71v8qc
5492,reddit quarantine offensiveåêcontent httptcogllawb2fsk httptco3kaafuoztc
5493,reddit update content policy promise quarantine û÷extremely offensiveûª community httptcoplmiwofpom
5494,love chicago much game pink eye sit design quarantine dark
5495,reddit quarantine offensive content httptcolodormtfsq
5496,reddit quarantine offensiveåêcontent httpstcomjbiuvbmo6 httptcoi5cdtd8ftj
5497,reddit quarantine offensive content httptcoltmgdp6jaf
5498,top link reddits new content policy go effect many horrible subreddits ban quarantine httptcou9ao3a4ogc
5499,quarantine little corner bc sick office work pile need kinda day
5500,reddits new content policy go effect many horrible subreddits ban quarantine httptcoohbv7yvtl5 httptcoymuti3nd9r
5501,top link reddits new content policy go effect many horrible subreddits ban quarantine httptcoo8xvtlp4mf
5502,hot reddits new content policy go effect many horrible subreddits ban quarantine httptcouisnqiu3if prebreak best
5503,official alabama home quarantine possible ebola case httptcouyugfg3k1h
5504,hot reddits new content policy go effect many horrible subreddits ban quarantine httptcoalgtcn8baf prebreak best
5505,reddits new content policy go effect many horrible subreddits ban quarantine httptcom4tczaawpt
5506,go ebola run live aaarrrgghhh httptcog2uimbekge
5507,reddits new content policy go effect many horrible subreddits ban quarantine httptcozsxqbduzbn httptco6ncfjxploy
5508,fuck yes rantipozi quarantine triggered cucks
5509,hot reddits new content policy go effect many horrible subreddits ban quarantine httptcongkrzpza45 prebreak best
5510,reddits new content policy go effect many horrible subreddits ban quarantine httptcolfw4kuukem httptcok3mnk9hnz5
5511,user sub quarantine httptco9nly2tovud
5512,official alabama home quarantine possible httptcorb2s0jmlej
5513,scrambledeggs call kia get ban quarantined month end
5514,official say quarantine place birmingham home possible ebola case edward khan httptcoqnij2p8zv6
5515,gmtty mhtw4fnet official alabama home quarantine possible ebola case washington time
5516,top link reddits new content policy go effect many horrible subreddits ban quarantine httptcobjvfk1ete9
5517,reddits new content policy go effect many horrible subreddits ban quarantine httptco4onvxncz8w httptcotnggxnm6k8
5518,top link reddits new content policy go effect many horrible subreddits ban quarantine httptcozcp5cszsll
5519,alabama home quarantine possible ebola case official say quarantine place httptcoztonvgubvm bluehand pjnet
5520,hm mt ebolatrends alabama home quarantine possible ebola case httptcoihvmtmzxne httptcojliemrsnnj
5521,im go say new reddit policy change think rconspiracy quarantine thats bad truth mû
5522,okay cat quarantine bathroomits meow really loud turn tv louderthings might work okay
5523,alabama firefighter quarantine possible ebola exposure httptcohzpx6vaqpz report httptcol4w0pcorbs
5524,0npzp mhtw4fnet official alabama home quarantine possible ebola case abc news
5525,alabama home quarantine possible ebola case ambulance sit outside university alabama atû httptcoy2jt1amyfj
5526,hot reddits new content policy go effect many horrible subreddits ban quarantine httptcohqdczzdmbn prebreak best
5527,reddits new content policy go effect many horrible subreddits ban quarantine httptcogix1gaynxz httptcop93s2rfhx6
5528,hey reddit concept quarantine make sense people youve quarantine wander amp whenever want
5529,ebola alabama home quarantine possible ebola case related article httptcobiigd1leq3
5530,oc73x mhtw4fnet official alabama home quarantine possible ebola case washington post
5531,top link reddits new content policy go effect many horrible subreddits ban quarantine httptco0lpu0gr2j0
5532,cant dl patch fix error symantec quarantine computer ergo stop wireless exchange lol technology
5533,top link reddits new content policy go effect many horrible subreddits ban quarantine httptcocd2ng2awql
5534,hot reddits new content policy go effect many horrible subreddits ban quarantine httptcovhrlswvzql prebreak best
5535,httptcox5xumtoeke nuclear emergency current usa radiation level monitor site
5536,like youtube video httptcov57nugmgkt us canada radiation update emergency fishing closure
5537,wipp emergency activate slightly elevate level radiation sejorg
5538,bad radiation exposure fukushima meltdown happen 47km northwestproof small emergency plan zone donûªt cut
5539,wipp facility nm investigate site filter radiation reading activate emergency ops center say offsite release
5540,radioactive box quarantine israelûªs ashdod port evacuate emergency team discover radiation emittin httptcoswq5lmydka
5541,radiation emergency preparedness start know get inside stay inside stay tune httptcorffpqbaz2f via cdcgov
5542,else want document radiation emergency procedures 06 24 09 radiation emergency procedures 06 24 09 httptcohxwfbpp1b3
5543,ccot tcot radiation nuclear emergency track center httptcokf74o2mcsc httpstcon2zhrchcgv
5544,due rainstorm last night cupcake decorate happen rec hall 2 proceeds iwk httptcoearonlwifh
5545,rainstorm downtown gloucester gloucester capeann seagull triciaoneill triciaoneillphoto httpstcools6qdi9um
5546,myrtlegroggins ltgaspgt forgot sunday omg
5547,wow beauty lie within every storm take today rainstorm aampb pipeliners httptcopst5bbq0av
5548,rainstorm destroy 600 house yobe state rainstorm destroy 600 house yobe state daily trust damatu httptcorzxqssun02
5549,go beach jim alves mean guaranteed rainstorm lucky httptcofejs0bu0sq
5550,dnb newrelease edge jimmy summer rainstorm lapaka sound httptco4l8h2fklno via httptcozitqkdfxjy
5551,three people kill severe rainstorm italian alp cause landslide httptcohaxj6go2ac
5552,landslide italian alp kill three rome reuters three people kill severe rainstorm th httptcouzwxjbg0zh
5553,rainstorm destroy 600 house yobe ireporter httpstco0rny349unt via sharethis
5554,stuck rainstorm stay toward middle road street crown water tends pool side
5555,major rainstorm happen im gonna lie drift away storm around little bebacksoon
5556,landslide italian alp kill three rome reuters three people kill severe rainstorm httptcoboygbp0jw9
5557,cant roar wave rainstorm amp rollingû httpstcodlvyfvnqee
5558,robotrainstorm two vacancy castle fantasy football team join us itûªs fun
5559,calum5sos look like get catch rainstorm amaze disgusting time
5560,rainstorm update north south httptco50vdq7a1m5 httptcoqh6oxft9ir
5561,nigeria rainstorm destroy 600 house yobe state daily trust damaturu 600û httptcobbqnk76qus
5562,landslide italian alp kill three rome reuters three people kill severe rainstorm th httptcosmkznf52za
5563,rain rain go away soaker way gt httptcojqfcy9guqv lt httptcotn65puhfhw
5564,nathanfillion hardly
5565,tomorrow even commute receives red light rainstorm impact region push way late evening httptcodrvm8isote
5566,rainstorm didnt last nearly long enough
5567,robotrainstorm imsort interested font theyre use
5568,lizzie363 cstsmith drive thru deep water flash floodrainstorm repair cost 14000 25 yr later people still thnk car float
5569,best believe wrong decision make memphis street rainstorm lol folk doe
5570,want rainstorm please
5571,wake sick rainstorm outside would usually make sad today though put kook stereo let
5572,yay feel wind gear rainstorm vancouver bring drought deadgrassandflowers wildfire
5573,robotrainstorm im huge football fan know ive never do fantasy league patience newbie
5574,way move like full rainstorm im house card
5575,rainstorm destroy 600 house yobe state httptconu0d3uannz
5576,way move like full rainstorm im house card
5577,landslide cause severe rainstorm kill 3 italianåêalps httpstco8bhvxx2xl9 httptco4ou8s82hxj
5578,former freedom surfspa raze make way new home httptcoex6jzqj3ni
5579,late home raze northern california wildfire abc news httptcoaknbtuyaef
5580,tension abia inec officeûªs razedåêûò governor ikpeazu pdp apga react httptcoakzzoe5ce6
5581,late home raze northern california wildfire late wildfire burn california andû httptco0keh2treny
5582,late home raze northern california wildfire httptcontswuayeji httptcowgefbuk4jk
5583,late home raze northern california wildfire abc news httptcozbzc8905gl
5584,late home raze northern california wildfire abc news httptcoly8x7rqbwn
5585,httptcoixiybap8qa late home raze northern california wildfire lynchburg news advance httptcozepzqydby4
5586,news late home raze northern california wildfire new york time httptco5kbrzzmf8c tafs fb100
5587,late home raze northern california wildfire abc news httptcod1vjoyg52a
5588,late home raze northern california wildfire abc news httptcodofrh5yb01
5589,late home raze northern california wildfire httptco2nip3d15dx httptcoegyfnlaoqv
5590,late home raze northern california wildfire httptcobsgr67dywy httptcondggr6xyqd
5591,late home raze northern california wildfire httptco5fcjvml520 httptcofvyrwhux8p
5592,petereallen huffpostuk bbc5live significant think iconic pic church maybe ruin less substantial effort raze
5593,late home raze northern california wildfire httptco3tnuaciv3c httptcosakorgdqul
5594,late home raze northern california wildfire httptcop3g3bqbczu httptcorpbxdfnx5k
5595,late home raze northern california wildfire abc news httptcox1xj0xvtj7
5596,davidvonderhaar least sincere
5597,late home raze northern california wildfire abc news httptcorg9yaybosa
5598,late home raze northern california wildfire abc news httptco2872j5d4hb
5599,late home raze northern california wildfire httptcoecxmoinzgu httptcontwwdwednb
5600,home raze northern calif wildfire httptcou52rw9ji2r sandiego httptcogx75w3q9ye
5601,george njenga hero save burn friend raze wildfire httptcoywkk26arag
5602,today another dualcom imrazed enjoy yesterday check today 5 pm easter
5603,late home raze northern california wildfire abc news httptcobksyymvisg gn
5604,late home raze northern california wildfire abc news httptcorlpttkbg4w
5605,late home raze northern california wildfire abc news httptco6acswzo7cw
5606,late home raze northern california wildfire abc news httptcohckxj8eukt
5607,late home raze northerncalifornia wildfire httptcomonijjth7v zippednews httptco0yxbb5dzw5
5608,late home raze northern california wildfire httptcor1cnsjuayq httptcodq1ylcrf9k
5609,george njenga hero save burn friend raze wildfire httptcous8r6qsn0p
5610,late home raze northern california wildfire httptcoirqujaesck httptcoqdweknrmi9
5611,late home raze northern california wildfire abc news httptcoauezxza5ak
5612,vassalboro house raze make way public gazebo petelmcguire report httptcouuewccdtow
5613,justmarried turkish couple give 4000 syrian refugee incredible gift httptcoibed3xg7fy feed instead family amp friend
5614,police monitor 200 jihadis poland httptco1wcofmlub9 via freedomoutpost
5615,turkish newlywed donate wed money beautiful gesture still faith humanity httptcoo1enhjrkjd
5616,justmarried turkish couple give 4000 syrian refugee incredible gift washingtonpost httptcoarkmc7vcln
5617,repulsive refugeesvictimiserdutton evangelicalliarabbott co lnp dupe press overdrive choppergatebronwynbishopauspol
5618,retweet cameroon repatriate 12000 nigerian refugee due boko haram httptcowvvgmeja7l
5619,newlywed fee syrian refugee wed cbc news late canada world entertainment business news httptcoqu8s89pvvt
5620,wowo 12000 nigerian refugee repatriate cameroon
5621,hmm 12000 nigerian refugee repatriate cameroon httptcoytw9slwvmg
5622,whao 12000 nigerian refugee repatriate cameroon httptcobae0ap4g9y
5623,imagine entire aisle dedicate make people look like serbian refugee director whole food clothing section
5624,viralspell couple spend wed day feed 4000 syrian refugee httptû httptcoi1vpkq9yag see httptcoty5gavn7uk
5625,reaad plsss 12000 nigerian refugee repatriate cameroon
5626,top story viralspell couple spend wed day feed 4000 syrian refugeesû httptcoa2tiivnjdy see httptcofw2xifj6ec
5627,refugee connection indiegogo campaign go live tomorrow support us help launch online community refugee
5628,yall read 12000 nigerian refugee repatriate cameroon httptcoavwe1lbvhn
5629,short throw overboard dont think leader could much worse refugee tonyabbottmhr bad pm ever
5630,cameroon repatriate 12000 nigerian refugee httptco6nqru2q5tz
5631,captain abbott must go lnp boat refugee christianvalues httpstcokp5dpoaf58
5632,turkish couple spent wedding day feed 4000 syrian refugee turkish couple get marrie û httptcoigll3ph6o1
5633,one couple use drone save refugee world deadly border httptco9qpg0z3rh9
5634,whao 12000 nigerian refugee repatriate cameroon httptcohuhwpmrywz
5635,hmm 12000 nigerian refugee repatriate cameroon httptco96p3hujntj
5636,turkish couple decide feed 4000 syrian refugee part wed celebration httptcoehlq3zsptd httptcodjx5elbrv1
5637,fadelurker dalinthanelan lt right even two year still refugees camp south redcliffe village aidan gt
5638,newlywed fee thousand syrian refugee instead host banquet wedding dinner httptcoegcv7ybjae age news
5639,photo young refugee force flee burundis violence vice news httpstcojojnq2oopi see httptcodskui6mmgl
5640,kristindavis un refugee thank un refugee help many people need world httpstcoypvjgzqqqb û
5641,wowo 12000 nigerian refugee repatriate cameroon
5642,newlywed fee thousand syrian refugee instead host banquet wedding dinner httptcoxzv0lt9zzk via smh
5643,httptcoehklp12yip pacic medium centre article australia rsf protest new security gag reporting
5644,recap 12000 nigerian refugee repatriate cameroon httptcopo19h8ycnd
5645,generous bride earth couple feed 4000 syrian refugee wed day httptcoms8e8mnddb via thedailybeast love
5646,whao 12000 nigerian refugee repatriate cameroon httptcopo19h8ycnd
5647,46 returned refugee flee amp vietnamese govt treat return dutton presser
5648,chpsre rt refugees follower paris visit dream humanity exhibition rezaphotography û û httptcorpmtropsvr
5649,policyholder object clico rescue plan httptcoe4dvi9vuxz httptcojycpf8iyhg
5650,dont panik kelbytomlinson rescue httptcohujvgsflus
5651,coastal german shepherd rescue oc share link httptcop85nwcmkqu animalrescue httpstcowudlkq7ncx
5652,ud rescue structural collapse scott road ypres road york 14 truck
5653,rescue day itûªs world cat day saturday aug 8th black blackwhite cat 5 httptcooqb7dasmvy newbeginningsanimalrescue
5654,im 2 blood pressure med still probably roof long ppact story break involve animal rescue
5655,coastal german shepherd rescue oc share link httptco35qwnglkos animalrescue httpstcois2idc3ubj
5656,coastal german shepherd rescue oc share link ecstatic rescue racco httptcot8q6dzvgwx animalrescue
5657,suggs amp vivian rescue psychrewatch
5658,length rescue cat need httptcoamrox4y4nx
5659,last chance animal rescue 3 new post httptcof1tcbg1mki animalrescue httpstcois2idc3ubj
5660,last chance animal rescue 3 new post httptcokiildu8gpo animalrescue httpstcowudlkq7ncx
5661,sammy todd always rescue may uniform still rescue lmao forever kfc fam
5662,lunch crew make night night long day peaceloverescue
5663,tell united nation plantation forest httpstcocic7h64qv8 via rainforestresq
5664,mary come troy rescue httpstcorosvxqelqj
5665,ud rescue structural collapse scott road ypres road york 14 truck
5666,floodzone general raheel sharif visit chitral also laud effort fwo army troop army aviation rescue opera
5667,last chance animal rescue 3 new post httptco1eb2dauyfn animalrescue
5668,lisavanderpump many dog rescue dog
5669,official rescue 367 migrant libya 25 body find fox news httptcocedcugeuws news
5670,coastal german shepherd rescue oc share link httptco2jxkmkpalp animalrescue httpstcoec46lyqqc6
5671,zakbagans sabrina dad rescue dude keep cage weve since 4 httptco1k2phqcuw8
5672,briton rescue amid himalaya flood httptcowgrxly9pdo httptcobj4haavaye httptco59p3aoiqus
5673,4 kidnap lady rescue police enugu nigerian tribune httptcoxyyev89wiz
5674,rescue med migrant arrive sicily httptcoz8xiqngulc
5675,tennoatax hand glass water sit rescue tenno ive live ship around dojo year
5676,trust us get rescue dopey one val hilarious shame shes probably go die emmerdale
5677,summer summervibes california puppy pitmix rescue brixton banksy happy mybabies httpstco7vovktxspo
5678,man bury dog alive thought one would find rescued time httptcosahq5uoahw
5679,10monthold baby girl rescue coastguard float half mile sea socialnews httptcokjuzjc6igd
5680,skyrim awaits rescuedagain
5681,rescue med migrant arrive sicily httptconekm1rpohu
5682,finnish hip hop pioneer paleface rescue drift raft bring container later enkelbiljett menolippu
5683,18 bovine rescue 3 smugglersåênabbed httptcoe7fn5g5ruu
5684,fund need rescue abandon cocker spaniel httptcorjrmw7nzy5
5685,like youtube video httptco45twhj0l6m romanatwoodvlogs rescue sick kitten
5686,news briton rescue amid himalaya flood httptcokepznhxhxd
5687,brave little dog get rescue river recovery inspi httpstcojywfygclhm via youtube
5688,homeless man travel across usa 11 stray dog rescue get help hand stranger httptcoqhfqlui6ry via reshareworthy
5689,brittanypetko break news tonight kid rescue play room week food water parent sex life haha
5690,rescue actually pretend giorgio hiatt
5691,rescue dog least 9 year ago shes old still sweet ever zakbagans httptcoyhyy3o609u
5692,httptcoqgyn2u1up3 rescue med migrant arrive sicily hundreds migrant rescuedû httptcowis3h9tqrm
5693,werent take back africa rescue c4news
5694,migrant rescue boat capsizes libya httptcopmggavtokp
5695,young child among rescue capsize boat libya httptcokot9zvd2h7 via irishtimesworld
5696,hero springer spaniel amp dog dad rescue stranded baby dolphin httptcog03dkpoonp httptcogo0hpi0b4c
5697,trust us get rescue dopey one emmerdale summerfate
5698,three beach whale rescue kerry httptcorqbspucjdf
5699,rescue tb go ribbon hit httptcopa5sslefec via offtrackhorse
5700,turn back rescue swept away sin though cloud isaiah 4422 contemporary english version
5701,zakbagans pet r like part family love animal last 2 pet rescue break heart animal mistreat
5702,like youtube video httptcofnpdjwvw1j homeless dog live cardboard box get rescue amp heartwarming
5703,angry mistrustful rescue elephant find peace friendship new home photo httptcovaunps6wja via onegreenplanet
5704,photo hundred rescue migrant await disembarkment irish naval vessel palermo italy tconnellyrû httpstcoaim5cyhl0y
5705,rescue med migrant arrive sicily httptcop4doa5yyje
5706,video pick body water rescuer search hundred migrant httptcobs6pjt09tc africa news
5707,video pick body water rescuer search hundred migrant mediterran httptcos5nuegswyj
5708,video pick body water rescuer search hundred migrant mediterran httptcociwwuqthin
5709,video pick body water rescuer search hundred migrant mediterran httptcogeu4h46csz
5710,video pick body water rescuer search hundred migrant mediterranean httptcoyhqu5uv6ok
5711,world fear miss migrant med rescuer search survivor boat carry many httptco6ds67xai5e news
5712,durbanknight rescuer search hundred migrant mediterranean boat carr httptcocwcvbubs01 nosybe
5713,unexplainable desire watch rescuer childhooddefined
5714,roddypiperautos fear miss migrant med rescuer search survivor boat carry httptco97b8avgewu
5715,andygilder channel 5 rspca dog rescuersthe infomercial crept back door
5716,video pick body water rescuer search hundred migrant mediterranean boat carryi
5717,womanûªs gps app guide rescuer injured biker marin county httptcouojy4e2sv4
5718,video pick body water rescuer search hundred migrant mediterran httptcozg1yddywa5
5719,video pick body water rescuer search hundred migrant mediterran httptcopuezv6bd37
5720,video pick body water rescuer search hundred migrant mediterranean boat carryi
5721,video pick body water rescuer search hundred migrant httptcoawtscucbbv africa news
5722,last second ebay bid rt httptcooekucq4zl0 shaolin rescuer dvd 2010 shen chan nan chiang five venom kung fu please favori
5723,video pick body water rescuer search hundred migrant mediterranean boat carryi
5724,worldnews video pick body water bbc news home rescuer search hundred httptco6hhmbdk9yo
5725,video pick body water rescuer search hundred migrant mediterran httptcozfwmjh6slh
5726,httptcoxlfi7ovhfj video pick body water rescuer search hundredsû httptcoraq4zpdvke
5727,ahmazing story power animal rescuer starve homeless dog future rescue person httptcoficd5qbqwl
5728,rescuer search hundred migrant mediterranean boat carry many 600 people capsize coast ofû
5729,news many death shipwreck rescuer try save hundred migrant httptcotx51oybrn6 via thenewshype
5730,video pick body water rescuer search hundred migrant mediterran httptcopspm3ahgkq
5731,video pick body water rescuer search hundred migrant mediterran httptcoyvo6q6w442
5732,rescuer find barely alive idea allergic httptcovecmsiuuh1
5733,fear miss migrant med rescuer search survivor boat carry many 600 migrant httptcogx9skuau9j
5734,video pick body water rescuer search hundred migrant mediterranean boat carryi
5735,woman gps app guide rescuer injured biker marin county sfgate httptcoiz9u8bhfaa
5736,fear miss migrant med rescuer search survivor boat carry many 600 migrantsû httptcov9ftyb30ei
5737,rescuer find survivor nepal earthquake bury httptcoi8sj1kws1d
5738,rescuer recover body 37yearold calgary man lake near vulcan û httptcogaehr9bhek
5739,fear miss migrant med rescuer search survivor boat carry many 600 migrantsû httptcoixfne5jlep
5740,video pick body water rescuer search hundred migrant httptcouymxocfs33 bbc news
5741,meatloving feminist world riot grill arrive pop quiz prefer fem httptcokmndkfa7me art
5742,stuart broad take eight joe root run riot aussie
5743,piprhys predict riot
5744,teamvodg discover nickcannon listenbuy realmandyrain riot itunesmusic itunes httpstcodehmym5lpk û blowmandyup
5745,meatloving feminist world riot grill arrive httptcoum3wtl5r7k art httptco2lqyxzq5dn
5746,httptcocxb55h37jn rascal flatts riot tour atlantic city beach concertaugust 20 20152 ticket httptcoh6tyysgr30
5747,meatloving feminist world riot grill hasåêarrived httptcoudqa53kfqu
5748,seriously tactical riot headquarters disney marvel
5749,daniriot keep eye well look lot new team member come daysweeks
5750,meatloving feminist world riot grill arrive pop quiz prefer feminist httptcohxox7o42rq
5751,liveworkshop selfie booth riot kappa
5752,acaciapenn ill start big as riot send jail today mfs shidddd
5753,riot kit bah part new concept gear come autumnwinter menswear fashion urbanfashionû httpstcoccwzdtfbus
5754,abrancaballero discover nickcannon listenbuy realmandyrain riot itunesmusic itunes httpstcodehmym5lpk û blowmandyup
5755,like youtube video httptco5fr41tpzte thorins thought riot sandbox mode lol
5756,stuart broad take eight joe root run riot aussie stuart broad take careerbest figure 8 httptcozgsjwxdrcm
5757,retweeted sarah silverman sarahksilverman soundtrack walk start w tracey ullman dont know perfect
5758,meatloving feminist world riot grill arrive httptcotiost8okvx
5759,time riot really make official satan teemo skin httptcotytpbc4gwi
5760,like youtube video httptcolamsdzkcuz sick riot shield slide spot
5761,bytorrecilla torrecilla always info secret lol game check secret get 600000 riot point bio
5762,transwomen drag queen color lead riot well know butch lesbian usually credit incite
5763,eac4au preorder film itunes amp watch 915 yay httptcofvp3wnid4l httptcobwdhibtiks httptcoqelroci7by
5764,without ally near cant use skill get hire really cause make every riot staff member look incompetent
5765,pop quiz prefer feminist revolution fry ravioliåêwith porcini ricottaû httptcon6mcpgvwq2 httptcos8oinfgxyx
5766,meatloving feminist world riot grill arrive httptcoskaausjpo4 oliviamiles01
5767,davidjordan88 stephanenny except dont know start riot even make sense credit particular individual
5768,trollkrattos juan carlos salvador secret tip get 100000 riot point lol check secret bio
5769,southeast dirt riot series crown champion southeast dirt riot series crown championsblackfoot id httptcov9i4pfxo0c
5770,sweetpea run riot allotment brighten rainy day httptco6ndbfopk5m
5771,stuart broad take eight joe root run riot aussie
5772,riot police intervene southampton vitesse arnhem supporter clash û¢ fan clash buildup second httptcoskvnmtzgeg
5773,jwalkerlyle discover nickcannon listenbuy realmandyrain riot itunesmusic itunes httpstcodehmym5lpk û blowmandyup
5774,cracker white riot httptcocc7d0wxk0m nowplaying
5775,government care police stop rioting eventually protestors eventually skyscrapers become plantcovered
