,text
2009,homeowner insurance cover water damage good thing know httptco0usdi5jcho httptcoxyg7jhrjof
2010,beach damage shit
2011,wonderousallure cross arm cover hand anymore damage hhello
2012,new post blog httptcoavu9b4k2rv thesensualeye model cam damage toronto apr 2014 nsfw pussy as boob asian nude û
2013,report hit amp runin roadwayproperty damage 15901 statesville rd
2014,devil may cry 4 special edition vergil v agnus window mission 6 dmd damage leedstraif httpstcozhrtcvu0ff
2015,glaucoma occur fluid build pressure inside eye level may damage optic nerve eyefacts
2016,jsunnews storm damage report madison county thunderstorm damage report ar httptcos7nbowa7tp via httptco3f7owdecy7
2017,s61231a puncture wound without foreign body leave index finger without damage nail initial encounter icd10
2018,thank richarkkirkarch ausinstarchitect word warn queenswharf brisbane httptcojmkywhv7mp via financialreview
2019,real shit damage bitch
2020,lmao fuckboy change damage control pseudojuuzo
2021,michaelwestbiz standard damage control
2022,gettinglost jennellensbb munclejim say superficial wound pepper spray damage
2023,blizzheroes dustinbrowder dad wont chase constantly amp time frequently great deal danger distraction lt3
2024,believe shirt company every animal ever danger well start see change wildlife
2025,danger union bear httptcolhdcpnzx6a
2026,signup open fall danger release day blast review tour signup httptcohbdo22nqpz
2027,dyannbridges yeshayad check rockin preview claytonbryant danger zone come soon httpstcoipgmf4ttdx artistsunited
2028,red flag warn fire danger amp dry thunderstorm bay area httptcougzu9iqprw weather cawx nwsbayarea
2029,carsonrex spaceangelseven check rockin preview claytonbryant danger zone come soon httpstcop0fizxmn5r artistsunited
2030,like could danger something
2031,last tree cut last fish eat last stream poison realize httptcohskl0vq2d2
2032,take away preservation park r imposition amp danger african people never imagine httpstcogi2p9tuvbi
2033,indian govt amp medium take serious concern safety danger httpstcoyx1ukbmtqb
2034,training grain wheat bare gold august heat anger im trespass l seek danger
2035,therealrittz fettilootch slanglucci oppression greatest danger come soon album httpstcomoll5vd8yd
2036,morehouse64 appear govt lose ethical moral relevance mean whole usa population danger
2037,dont like head first slide especially home danger
2038,permit bear hunt danger outnumber actual bear license floridas fir httptcofp64yosjwx st petersburg
2039,riverroaming much danger please
2040,bluebirddenver fettilootch slanglucci oppression greatest danger come soon album httpstcomoll5vd8yd
2041,uber look repair recent bad rap nonprofit partnership httptcoh1xch54kd3
2042,wish could get victorias secret front im good
2043,turnedonfetaboo hsjb215 check rockin preview claytonbryant danger zone come soon httpstcoe1wrvyzfkv artistsunited
2044,thetxi gunnersfan89 would arsenal fan want west ham relegation battle season danger afc sun
2045,remainontop fettilootch slanglucci oppression greatest danger come soon album httpstcomoll5vd8yd
2046,nugget fettilootch slanglucci oppression great danger come soon album httpstcomoll5vd8yd
2047,danger excitement underwater cave dive httptco8c3fploxcr httptcocbgz9xun2k
2048,girl wanna save like danger health try somebody wanna somebody else
2049,gun protection shit really shouldnt use unless life danger
2050,thirsty yall danger dehydration
2051,thunderstorm little rain expect central california high fire danger weather cawx httptcoa5gnzbusqq
2052,wanna get danger day tattoo bad cool would spider look like someone wrist smth
2053,experience youre always angry critical pundit grave danger go rail 1
2054,danger skyler danger
2055,dangerous ok rest us danger httpstcoyl67dkf4tb
2056,investigate robert mueller didnt respond complaint since nov 2011 amp leave meson danger httptcope2d3hcsni
2057,honestly tho modibo maiga steal live fuck im past best still danger fucktard coyi
2058,fear way make us see danger none contemplate logic behind situation find courage engage
2059,joel 228 book act 217 httptcorgpem2tqej
2060,17 dead afghanistan aircraft crash afghan military helicopter crash remote region httptcoki9ehjhl8y
2061,silent0siris even awesome norse landscape load atmosphere life boringdead snotgreen wasteland
2062,miss longer hairbut dead anyways wasnt even hair
2063,cjbanning 4sake argsuppose preborn attain individl rightsgenerally courtof law forbids kill unless dead person something
2064,remember time goku give life dead birb hell goku
2065,naaa bee dead like legit zombie feel every sore part body httpstcoj4fsdpfa63
2066,happen get road right behind bus im dead serious
2067,lmfao fuck luis hhahaha im dead
2068,watch emmerdale nd dont know slightly attractive man name ross get beat nd he dead
2069,soapscoop need confirm ross dead cause dont trust anyone else yh
2070,gailsimone iwasdisappointedby telltale walk dead good character ampstory real gameplay many performance issue
2071,beforeitsnews hundred fear dead libyan migrant boat capsize rescue û httptcomjoeebdlxn httptcofven1ex0ps
2072,itûªs war come see never see waved white flag front canûªt end dead wont mislead
2073,jones94kyle oh fuck sake dead
2074,emmerdale ross really dead askcharley
2075,avoid wear dead black flaming red stark white much esp debate go blue gold brown even shoe
2076,perspective grateful dead critical writing contribution study httptcofmu0fnumxf httptcoaggryhvxkr
2077,hlportal hello im look mod cold ice saw site link download dead maybe share thanks
2078,kg4vaal lmaovv hard ny new trend babalmaowelcome nyozi kwaaaaadead
2079,jones94kyle ive say he dead one else dy
2080,ross dead noooooooooooo mikeparractor
2081,think time friend bail nite b4 dead showwent alone amp great time alone free dance front row
2082,typhoon soudelor take dead aim taiwan httptcobhsuxvq6nf
2083,askcharley emmerdale emotional ross dead emmerdale 5
2084,man find dead demi moore swim pool httptcooctnpyueei
2085,thats val dead im sue
2086,atchisonsean dead
2087,wyrmwood road dead 2014 fuck awesome awesome end awesome one
2088,cant believe ross dead emmerdale mikeparractor emmerdale summerfate
2089,call text 2 nigga bff amp boyfriend love boys death nigga hold attention like
2090,hate talk otp grandma mean love death talk damn much ssshhheeesshh
2091,death ill forever rep jet
2092,vibrator shape vape do bust
2093,death threat nigga life well gon see
2094,adult die plague colorado httptcoyohvuwumzs
2095,xbox 360 pro console red ring death full read ebay httptco5gktshiorr httptco9jeuu86koi
2096,go back gainesville death
2097,year later ferguson see change ask itûªs real httptcoh9vmmdebdx
2098,papiichampoo enjoy obama era civility prez say gop support iranian death httptcojpu3es746i
2099,feel like death
2100,like youtube video jeromekem httptconq89drydbu dj hazard death sport
2101,tell cousin dont wanna hang text say come honestly death wish
2102,r judge order texas recognize spouse samesex death certificate httptcotziolfte5i
2103,loyalty mission involve kick shitty nobleman death love elven weirdo
2104,httptcolma39zrwoy way seemeth right unto man end thereof way death
2105,kellkane thanks narrowly avert death fun youre right
2106,httpstcoecmujkkqx1 arianagrande screamqueens katherines death
2107,allahsfinest12 death muslim
2108,go starve death
2109,ted cruz bash obama comparison gop iranian shout death america httptcocufgvupkzi
2110,httpstcooifn28hpcs arianagrande screamqueens katherines death
2111,new crime know right punishable death
2112,issue upload death smoochy awakening clip youtube reason bicentennial man pain as
2113,ted cruz bash obama comparison gop iranian shout death america httptcotxetcysm1h tcot
2114,cyprus news analysis mullah omars death may split taliban ranks omars demise would certainly lead httptcoajkmcuswho
2115,feel like deathholy molys
2116,video slain mexican journalist unknowingly predict death httptcoqxhowcv16r via breitbartnews
2117,old lady rockin death metal sedan downtown smoking cigarette find real mom
2118,afghan peace talk doubt mullah omars death financial time mullah
2119,yall pusssssssssy shoook death
2120,first trial death cecilthelion postpone httptcofnmje8gf7m httptconye8ae2ifr
2121,53 year ago week anniversary marilyn monroe death ripriprip
2122,aris hint snippet death
2123,tomorrow death
2124,new nyc legionnaire disease death toll rise httptconql21ajmiv follow httptco18xq3fmuge
2125,vaxshill 2 death measles complication 10 yr everyone loose shit 8 dead legionnaire month amp cricket
2126,bigamist û÷firstûª wife charge death û÷secondûª pregnant wife child 8 mother nephew 1 uû
2127,dont get i77 south huge wreck airlift maybe deaths interstate completely block
2128,ûïlolgop 22 case voter fraud year need new law 83 gun death day actually follow law amirite vra50û
2129,silence palermo shipwreck child death httptcotm9zbhjcyf
2130,bsf jawan die fidayeen ak bloody insas insas rifle blame soldier death mod httptco1lk1eqwyuw
2131,breast milk original superfood rate worldwide stall 40 contribute 800000 child death last year
2132,12 death redlight run crash pedestrian bicyclist amp vehicle occupant hit redlight runner
2133,rt truediagnosis 250k death per year physician error httptcodutyzqr2p7åê avoid one httptcooznsxxvxû
2134,cdcwhistleblower 2 death measles complication 10 yr everyone loose shit 8 dead legionnaire month amp cricket
2135,bigamist first wife charge death second pregnant wife child 8 httptcodlaub2nvtn news
2136,500 death year foodborne illness frackfreelancs dear deccgovuk frackfreeeu tarletonsophie httptcojsccx8k0ja
2137,hear drfriedencdc talk avoid thousand resistant infectionsdeaths next 5 yr httptconiv8x5tbe0 adiossuperbacterias
2138,irony die thousand death httptcodbu30obdxz
2139,strickskin nickscomics lol usually im objective maybe uncle ben course deaths end business usual
2140,comment death old child data tell us httptcop8yr2po6jn nghlth
2141,death 7 httptcoxrja0xpl40
2142,eazzyp never know would happen govt seem think belief warrant deaths innocent jap
2143,real magic real life woman go miss ohio town focus fbi probe strange death httptco6m0ynjwbc9
2144,two case dont constitute epidemic httptcojblrrnmdsm plague health publichealth
2145,death 3 httptconapviygkyk
2146,lunch stewart amp julian couple hour earlier good finally find happened httptcoanp9g6njfd
2147,weyburn police warn public fentanyl death province httptco8bqjtp6id5 httptco8kjs7zqajs
2148,none annoy crusty life matter head as people ever actually support cause hate black death get attention
2149,time reduce gun death httptcoiladqebxpn
2150,gregorysanders usdot amp stat high auto death apply child vehicle guess run lightrail well adult
2151,cancer equate around 25 death blackpool kowing sign could save life httptco5lnidvobff beclearoncancer
2152,highqualitybird reverse situation lol dont know 911 us civilian death specifically utilized make political
2153,heard theres two death murder chrissie kill adam val finn die emmerdale
2154,mathewisangry z3kesk1 saladinahmed died horrible death trap ship know risk
2155,fco minister tobiasellwood condemn attack mosque saudi arabia result least 15 death httptcoc3w95h0ozz
2156,cancer equate around 25 death blackpool kowing sign could save life httptco11dvqjvxpo beclearoncancer
2157,critter climate two plague death colorado httptcodxkt2shuj2
2158,since 1940 year angela sander bear roundhouse kick related death increase 13000 percent
2159,walmart take step keep child safe hot vehicle take look innovative car seat httptcoz3nevglufm
2160,2010 17 beluga death report seaworld average age 15 12 year opseaworld httptcomzk5ujlfcv
2161,bigamist first wife charge death second pregnant wife child 8 mothe httptcorteugb5tnv
2162,mayoroflondon pls reduce cyclist death compulsory highway code test every vehicle use road notrocketscience
2163,aerospace exec plane debris miss mh370 part aircraft wing find reunion island th httptcos2wm8lh7oo
2164,malaysia airline flight 370 disappear 17months ago debris find south indian ocean httptconrhurysypd
2165,mh370 aircraft debris find la reunion miss malaysia airline httptcomrvxbzywd4
2166,discover plane debris miss malaysia airline flight 370 time httptco7fsn1gewux
2167,confirm debris mh370
2168,mh370 aircraft debris find la reunion miss malaysia airline httptcoq1glk8plud
2169,malaysia confirm plane debris wash reunion island flight mh370 httptcobmxsndx14g
2170,mh370 aircraft debris find la reunion miss malaysia airline httptcohhwv0eudfv
2171,miss jetûªs debris could float rì©union new york time httptcopnnunrnqja
2172,rì©union debris almost surely flight 370 official say new york time httptcogyqlaoz3l2
2173,rì©union debris almost surely flight 370 official say new york time httptcovfbw3nyo9l
2174,debris find reunion island flight mh370 mystery behind plane disappearance could better novel
2175,mh370 aircraft debris find la reunion miss malaysia airline httptcootsm38xmas
2176,reuters debris confirm mh370 relative hope discovery crash site httptcodfyasvj7nf
2177,nbcnightlynews malaysian official say debris find reunion island mh370 billneelynbc report httptcofoutpwgfwy
2178,mh370 debris find reunion island sad tragedy innocent crash mh370
2179,love food fun malaysian prime minister najib razak confirm aircraft debris find rì©union isla httptcofk1l4nozig
2180,malaysia seem certain france plane debris miss mh370 httptcoexznmxbinj
2181,malaysian official say debris find reunion island mh370 billneelynbc report httptcor6kzsqdghz
2182,mh370 aircraft debris find la reunion miss malaysia airline httptcozxcorq0a3a
2183,debris find reunion island come mh370 malaysian pm httptcof75qwyeeec
2184,aircraft debris find island mh370 malaysia confirm httptcox3rcchkago
2185,irony debris flight mh370 find reunion island
2186,mh370 aircraft debris find la reunion miss malaysia airline abc online httptcoc5jutfxbm9
2187,mh370 reunion debris miss malaysia flight httptco6ime8kjacv
2188,expert leave lab malaysia confirms debris mh370 httptcoba4pusvjln
2189,malaysia confirm plane debris wash reunion island flight mh370 httptcoys3walzvjg
2190,kamindoz reuters debris confirm mh370 relative hope discovery crash httptcoxrdwr8cdvm httptcofxtffl4axy
2191,plane debris discover reunion island belongs flight mh370 ûò malaysian pm httptcojkc0diqvxc
2192,debris confirm mh370 relative hope discovery crash site malaysian official confirm breakth httptcomgyvglenks
2193,abc onlinemh370 aircraft debris find la reunion miss malaysia airline abc onlinea piece aircraft debris
2194,malaysia confirm reunion island debris mh370 httptco1beegwrsis scmpnews httptcodrculiyp0t
2195,debris confirm mh370 relative hope discovery crash site httptcorlftjmhhvt via reuters video
2196,plane debris miss mh370 httptcokxy56fr8vm
2197,mh370 aircraft debris find la reunion miss malaysia airline abc onlin httptcon3lndjkyo3 g malaysia news
2198,interest mh370 aircraft debris find la reunion miss malaysia airline abc httptco950xijhnvh please rt
2199,aircraft debris confirm mh370 nation star online httptcohes0bpu60y
2200,dustpiggies ah awash abstract dustpig tweet explain deluge
2201,xeni bet mother nature might plan send deluge way
2202,joshsternberg feed seem deluge twice week itûªs fantastic
2203,romeocrow welcome organize twitter find important stuff amongst deluge btw love music sign ep
2204,niagara fall package deal deluge tour yyeso
2205,apologise sincerely inevitable deluge gbbo tweet come wont hold grudge decide unfollow baking cake
2206,rt nlmdimrc deluge resource flood medical provider cleanup worker amp httptcoauoeyirqe6
2207,towboat trek sympathy deluge fall vtc httptcoeaaqumkkc9
2208,deluge eulogy cecilthelion whatsapp gtgtthis torment soul matias xavier
2209,wa smile july deluge west australian httpstco4yi4nuovbv via yahoo7
2210,china delay deluge fundamental economy support valuation stock httptcofwikyurc18
2211,despite deluge fantasticfour notice man ocuana still buy ticket hes bloodyminded like
2212,photo forrestmankins colorado camp httptcos0vgtkhw7v
2213,deluge troisrivieres one hour get legionstrackandfield httptcopue5xnznqb
2214,many halfnaked men twitter tonight normally id embrace odd torso scale tonight deluge unprecedented
2215,theburnageblue yes man bad week far event deluge favs turn right around
2216,best window torrent client recommend deluge look like write 10 year ago java swing us bad
2217,fifth predynastic king legendary period deluge httpstcoyr8knephgu dumuzid shepherd
2218,theghostparty amsosorry deluge hell vine
2219,strange encaustic cerography portion till give voice deluge byityf httptcoi7ap1mes8m
2220,back beach deluge surf camp motion surf therapy programme kick today httptcovjsaqpxngn
2221,stephaniemarija light rain forecast base dress light rain incessant deluge
2222,perhaps historic apply deluge recently expose childsexabuse truly historic scale coverup
2223,bible sometimes back truck unloads descriptive deluge indecency us chuckswindoll explain iflcanada next
2224,audio 16 business owner share would differently pt1 httptco9utqe9zfde
2225,whole slew updated post come host fix unfml deluge
2226,photo boyhaus heaven send jakeåê ûïafter warm morning montanaûªs madison river early even httptcofid3z4x3s5
2227,famping thing gishwhes get soaked deluge go pad tampon thx mishacollins
2228,fiendnikki deluge awesome word idea like much
2229,wrinkled face deluge decay
2230,schelbertgeorg thanks im teach online class amp ask student lots question like sorry deluge ren art
2231,shadowman save big easy deluge supernatural monstrosity read free httptcotbpqlyfyot httptcohdckeposqc
2232,houghjeff crap content marketing deluge dougkessler b2b b2bagency httptcoenqgtbaxuj via slideshare contentmarketing
2233,love song heal heredeluge ampwanted sing church spanish translate httptcodmrsyeiqz3
2234,vince mcmahon billionaire remember read deluge post vince mcmahon lose 350 httptcoko0oz3ryfg
2235,nfl play deflategate perfectly deluge incremental story bore world care want go away
2236,youre search powerful content improve business frustrate deluge quantitûhttpstco64cymg1ltg
2237,whats miss asae15 exhibitor email value httptcor8ceprqxle assnchat
2238,meditationbymsg 45600 ppl get method meditation ampgot deluge divine bless 4 happy n peaceful life httptcovmf5lnxvzc
2239,im uk isnt deluge canadian theme top aroundthe time perfect cant quite believe mad
2240,tomorrow internet day almost 2 month look forward deluge stuff ive avoid downright lie
2241,novalismi joseph mallord william turner shade darkness even deluge 1843 clicca sul titolo httptco458dtr3ulx
2242,anyone else get ton telemarketing call cell phone ive deluge
2243,thewesterngaz im sure shop deluge local child want buy really
2244,susinesses deluge invoice make stlnd colour shape likely rise top pay pile
2245,glimpse hyderabad deluge heavy rainfall httptcodctv1ujlhc httptcoqox1jnqsau
2246,business deluge invoice make stand colo r shape lzkely rise top pay pile
2247,also matter week amazons go deluge poorly write indie dystopian fiction teen escape blood farm
2248,business deluge invoice make stand colour shape likely ri togthe top pay pile
2249,business abe deluged invoice make stand colour shape likely rise top paypile
2250,deluge low selfimage take quiz httptcoxspqdoriqj httptcocqyvfr4ucy
2251,business deluge invokces make stand colour shapeand likely rise top pay pile
2252,lisatoddsutton reason bring bcz run 4 senate murphy nothing republican deluge junk mail
2253,deluge low selfimage take quiz httptco1pflm532mg httptco58qrugzvg0
2254,thesewphist whoever hold address fuckfacewineisdumbcom go deluge spam mean
2255,tarp protect outfield cannot move infield get deluge
2256,business deluge inroicesmake stand colour shape likely rise top pay pile
2257,eu state squabble immigration ukfrance eurotunnel deluge migrant one dead thousand storm tunnel httptcovf6cklmcsx
2258,business deluge invoice make stand oup colour shame likely rise top pay pile
2259,business deluge invzices make stand colour shape itsllikely rise top pay pile
2260,business deluge invoice make stand colour shape likely rise top e pay pileq
2261,accionempresa us department commerce deluge last two month com httptcov1sfllowgh gerenciatodos å¨
2262,feel deluge low selfimage take quiz httptcoqn4zyisspo httptco3vwp7wd56w
2263,business deluge invoice make stand ogt colomr shape likely rise top pay pile
2264,business aredeluged invoice make urs stand colour shape likely rise top pay pile
2265,valdes1978 forgive bit testy deluge hatred amp lose patience
2266,news alert glimpse hyderabad deluge heavy rainfall
2267,afterwards alone hour savour prolong almost physical intensity feeling deluge sigue
2268,theyve come back gtgt fly ant day capital deluge annual swarm wing insect httptcomnkoyz76cp
2269,rand paul debate strategy demolish bad idea point maybe em httptcoqzdqrbr4lh
2270,enugu government demolish illegal structure international conference centre httptcodaqszzubub
2271,enugu government demolish illegal structure international conference centre enugu state government app httptcomskn6d3ekh
2272,doone silver architect permission demolish birmingham natwest tower replace cityûªs tallest building
2273,us four demolish createdunique23 kerenserpa arianareed11 httpstcopcinc8ytfh
2274,enugu state government appear set recover portion enugu international conference ce httptcow56cf75mxe badotweet
2275,kirkmin listen demolish barthubbuch weei cant wait bait patriot hater coworkers brady discussion
2276,ugh hungry im go demolish food
2277,demolishdeep space etoffe charmeuse clothesless precisionistic vestment psfda
2278,enugu government demolish illegal structure international conference centre httptco7k5shaiqiw
2279,enugu government demolish illegal structure international conference centre httptcoouylwuixcs
2280,xgninfinity ronincarbon hahah mutual host preset bal nades radar demolish
2281,yea im gonna demolish boundary seem unconsciously set negative thought
2282,nothing midget demolish show respect
2283,set goal demolish fitness inspiration
2284,set goal amp demolish
2285,rt abbswinston zionist terrorist demolish 18 palestinian structure jordan valley httptcorg3bndkxjx û httptcobq90pfzmrp
2286,mariomaraczi im watch right freak 1st first fight didnt demolish guy
2287,think akwa ibom donûªt come uruan demolish building exassembly member warns udom emmanuel httptco1cnw6nska5
2288,read already 14 remains one favorite article ever letûªs like demolish laundry httptco6supthaece
2289,imagine kp root wed demolish everyone
2290,absurdly ridiculous menûªs fashion demolish manhood httptcovtp8i8qlen
2291,far right racist avigdorliberman call destruction susiya previously also call beheading httptcoli8otxt8hh
2292,could demolish right httpstcosks5jccrj2
2293,postal service agree sell demolish downtown building httptco7mepkbf9e8
2294,news update enugu government demolish illegal structure international conference centre httptcoxcgzc45gys via daily post
2295,complete quest demolish 5 murlo android game tribez httptcopbclfsxrld androidgames gameinsight
2296,jollyjinu say terrorist babri ok demolish house todayhave right take revenge
2297,think ill become businessman demolish community centre build condo foil troupe multiracial breakdancers
2298,first counter league game another orianna happen demolish xd totally appreciate people play
2299,think go demolish drake house ghostwrite shit know rihanna life next door
2300,add video youtube playlist httptcok2bzuatuks dan arin demolish giant gummy bear grumpout
2301,nah srsly b4 u demolish ur partner face ampstart dribble nostril stop ampask urself whether really worth embarrassment
2302,charminar demolish fall state anyway take engineer opinion telangana
2303,beastin tapa even good folk funtimes demolish httptcojxuepkmkrh
2304,uribe demolish ball
2305,buy 64oz jar peanut butter get demolish
2306,colt get demolished patriot like 5007 whine nfl integrity cantmakeitup patriotsnation httptcotpw5gpmhq4
2307,flunkie make feel good im level 32 still get demolished
2308,angusmacneilsnp every case yes utterly demolish utterly iûªd embarrass bring indy ever
2309,stiiilo still get video u demolish
2310,get first gamer troll demolish kid philly toronto mlb upset backtoback chargedup
2311,church medium media420 silent papicongress demolish house journo uk pragnik
2312,man cam demolish plate as hungry
2313,finally demolish spring 2013 property sit vacant since justû saddlebrooke httptcokbstrxnhup
2314,absolutely demolished sounder start finish
2315,lol meerkat fuck get demolish periscope facebook live streaming
2316,demolish snowball
2317,finally demolish spring 2013 property sit vacant since justû saddlebrooke httptcob8n6e4ryvz
2318,ûïsplottdave teampalestina thats 28700 palestinian home demolish israel since 1967 w 0 israeli home demolish potus
2319,take china get demolish sent back fuck stone age
2320,home2 suite office come salvis bistro site former salvis bistro soon demolish makeû httptcopaobghv3c7
2321,bbsnews late 4 palestine amp israel six palestinian kidnap west bank hebron home demolish httptcogne1fw0xhe
2322,david5fernandez theblaze trump get absolutely demolish general election
2323,finally demolish spring 2013 property sit vacant since justû saddlebrooke httptcovcjcykq8b8
2324,stallion150 kbeastx totally demolished genisys beautiful film almost 90 people agree
2325,dangerous property downtown phoenix demolish httptcohibdw7d7ja
2326,demolish personal best httptcoimullbvued
2327,5000 year old ring fort demolish httptco1pxpoqktjo
2328,jackmulholland1 think also become marquis carlos amp charlies finally dublins sadly demolish
2329,demolished palestinian village come back life httptco9lpf4v4hmq
2330,three home demolish unrecognized arab village international middle east medium center httptcoik8m4yi9t4
