,text
0,deed reason earthquake may allah forgive us
1,forest fire near la ronge sask canada
2,resident ask shelter place notify officer evacuation shelter place order expect
3,13000 people receive wildfire evacuation order california
4,get sent photo ruby alaska smoke wildfires pour school
5,rockyfire update california hwy 20 closed direction due lake county fire cafire wildfire
6,flood disaster heavy rain cause flash flood street manitou colorado spring area
7,im top hill see fire wood
8,there emergency evacuation happen building across street
9,im afraid tornado come area
10,three people die heat wave far
11,haha south tampa get flood hah wait second live south tampa gonna gonna fvck flooding
12,rain flood florida tampabay tampa 18 19 day ive lose count
13,flood bago myanmar arrive bago
14,damage school bus 80 multi car crash breaking
15,whats man
16,love fruit
17,summer lovely
18,car fast
19,goooooooaaaaaal
20,ridiculous
21,london cool
22,love skiing
23,wonderful day
24,looooool
25,wayi cant eat shit
26,nyc last week
27,love girlfriend
28,cooool
29,like pasta
30,end
31,bbcmtd wholesale market ablaze httptcolhyxeohy6c
32,always try bring heavy metal rt httptcoyao1e0xngw
33,africanbaze break newsnigeria flag set ablaze aba httptco2nndbgwyei
34,cry set ablaze
35,plus side look sky last night ablaze httptcoqqsmshaj3n
36,phdsquares mufc theyve build much hype around new acquisition doubt set epl ablaze season
37,inec office abia set ablaze httptco3imaomknna
38,barbados bridgetown jamaica ûò two car set ablaze santa cruz ûó head st elizabeth police superintende httptcowdueaj8q4j
39,ablaze lord
40,check httptcoroi2nsmejj httptco3tj8zjin21 httptcoyduixefipe httptcolxtjc87kls nsfw
41,outside youre ablaze alive youre dead inside
42,awesome time visit cfc head office ancop site ablaze thanks tita vida take care us
43,soooo pump ablaze southridgelife
44,want set chicago ablaze preach hotel httptcoo9qknbfofx
45,gain 3 follower last week know stats grow httptcotiyulif5c6
46,west burn thousand wildfire ablaze california alone httptcovl5tbr3wbr
47,building perfect tracklist life leave street ablaze
48,check httptcoroi2nsmejj httptco3tj8zjin21 httptcoyduixefipe httptcolxtjc87kls nsfw
49,first night retainer quite weird good get use wear every single night next year least
50,deputy man shoot brighton home set ablaze httptcogwnrhmso8k
51,man wife get six year jail set ablaze niece httptcoev1ahoucza
52,santa cruz ûó head st elizabeth police superintendent lanford salmon r httptcovplr5hka2u httptcosxhw2tnnlf
53,police arsonist deliberately set black church north carolinaåêablaze httptcopcxarbh9an
54,noches elbestia alexissanchez happy see teammate train hard goodnight gunner httptcouc4j4jhvgr
55,kurd trample turkmen flag later set ablaze others vandalized office turkmen front diyala httptco4izfdyc3cg
56,truck ablaze r21 voortrekker ave outside tambo intl cargo section httptco8kscqkfkkf
57,set heart ablaze every city gift every skyline like kiss upon lip û httpstcocyompz1a0z
58,sky ablaze tonight los angeles im expect ig fb fill sunset shot know peep
59,west burn thousand wildfire ablaze california alone httptcoicsjgz9te1 climate energy httptco9fxmn0l0bd
60,revel wmv video mean mac farewell ablaze wmv en route dvd gtxrwm
61,progressive greeting month student would set pen ablaze torch publication httptco9fxpixqujt
62,rene ablaze amp jacinta secret 2k13 fall sky edit mar 30 2013 httpstco7mlmsuzv1z
63,navista7 steve fire something else california tinderbox clown set hood ablaze news24680
64,nowplaying rene ablaze amp ian buff magnitude httptcoav2jsjfftc edm
65,nxwestmidlands huge fire wholesale market ablaze httptcorwzbfvnxer
66,ablaze time talk go dont know make due work
67,cant kid cuz get bicycle accident amp split testicle impossible kid michael father
68,accident i24 w nashvilletraffic traffic move 8m slow usual httpstco0ghk693egj
69,accident center lane block santaclara us101 nb great america pkwy bayarea traffic httptcopmlohzurwr
70,httptcogkye6gjtk5 personalinjury accident summer read advice amp see solicitor help otleyhour
71,stlouis caraccidentlawyer speed among top cause teen accident httpstcok4zomof319 httpstcos2kxvm0cba car accident teeû
72,report motor vehicle accident curry herman rd near stephenson involve overturn vehicle please use httptcoybjezkurw1
73,bigrigradio live accident awareness
74,i77 mile marker 31 south mooresville iredell vehicle accident ramp close 86 118 pm
75,rt sleepjunkies sleep pill double risk car accident httptco7s9nm1fict
76,accident know gon happen httpstcoysxun5vceh
77,traffic accident n cabrillo hwymagellan av mir 080615 110358
78,i77 mile marker 31 40 south mooresville iredell vehicle accident congestion 86 118 pm
79,pastor scene accidentwho owner range rover
80,mom didnt get home fast wished mom accident truck spilt mayonnaise
81,horrible car accident past sunday im finally able get around thank god
82,wait see piss donnie tell another accident
83,truckcrash overturn fortworth interstate httptcors22lj4qfp click youve crashgthttptcold0uniyw4k
84,accident ashville us 23 sb sr 752 traffic httptcohylmo0wgfi
85,carolina accident motorcyclist die i540 crash car cross median motorcycle rider travel httptcop18lzrlmy6
86,fyi cadfyi accident property damagenhs999 piner rdhorndale dr
87,rt naayf first accident year turn onto chandanee magu near mma taxi ram halfway turn everyone confû
88,accident leave lane block manchester rt 293 nb eddy rd stop go traffic back nh3a delay 4 min traffic
89,accident property damage piner rdhorndale dr
90,accident httptcooia5fxi4gm
91,fyi cadfyi accident property damagewpd1600 17th st
92,862015209 pm traffic accident injury 2781 willis foreman rd httptcovckit6edev
93,aashiqui actress anu aggarwal nearfatal accident httptco6otfp31lqw
94,suffield alberta accident httpstcobptmlf4p10
95,9 mile backup i77 southaccident block right 2 lane exit 31 langtree rdconsider nc 115 nc 150 nc 16 alternate
96,accident change life help determine option financially support life care plan ongoing treatment
97,break deadly motorcycle car accident happen hagerstown today ill detail 5 your4state whag
98,flowri marinade accident
99,car even week get fucking car accident mf cant fuck drive
100,norwaymfa bahrain police previously die road accident kill explosion httpstcogfjfgtodad
101,still hear church leader kenya come forward comment accident issue disciplinary measuresarrestpastornganga
102,aftershockdelo scuf ps live game cya
103,man drive effort get painful man win roger bannister
104,320 ir icemoon aftershock httptcoynxnvvkcda djicemoon dubstep trapmusic dnb edm dance icesû httptcoweqpesenku
105,victory bargain basement price dwight david eisenhower
106,320 ir icemoon aftershock httptcovam5podgyw djicemoon dubstep trapmusic dnb edm dance icesû httptcozevakjapcz
107,nobody remembers come second charles schulz
108,aftershockdelo im speak someone use scuf xb1 people end get p also
109,harder conflict glorious triumph thomas paine
110,growingupspoiled go clay pigeon shoot cry aftershock
111,guess one actually want free aftershock tc
112,aftershock terrify best roller coaster ive ever disclaimer ive
113,aftershock httpstcoxmwodfmtui
114,320 ir icemoon aftershock httptcom4jdzmgjow djicemoon dubstep trapmusic dnb edm dance icesû httptcon0uhasfkbv
115,320 ir icemoon aftershock httptcovam5podgyw djicemoon dubstep trapmusic dnb edm dance icesû httptcozevakjapcz
116,320 ir icemoon aftershock httptcoe14epzhoth djicemoon dubstep trapmusic dnb edm dance icesû httptco22a9d5do6q
117,kjfordays im see issue aftershock
118,320 ir icemoon aftershock httptcothyzomvwu0 djicemoon dubstep trapmusic dnb edm dance icesû httptco83joo0xk29
119,320 ir icemoon aftershock httptcothyzomvwu0 djicemoon dubstep trapmusic dnb edm dance icesû httptco83joo0xk29
120,wisdomwed bonus 5 minute daily habit could really improve life many already lifehack httptcotbm9fqb8cw
121,aftershock protect profit next global financial meltdown david wiedemer http httptcowztz4hgmvq
122,moment get scary roller coaster guy behind scream bloody murder silverwood aftershock
123,aftershock ã¢ 2010 fullã¢ stream youtube httptcovve3usesgf
124,gtgt 15 aftershock protect profit next global financial book httptcof6ntuc734z esquireattire
125,sometimes face difficulty youre something wrong youre something right joel osteen
126,thing stand dream try belief actually possible joel brown
127,praise god ministry tell like wdyouth biblestudy httpstcoujk0e5gbcc
128,remember go die best way know avoid trap think something lose ûò steve job
129,tried orange aftershock today life never
130,onfireanders love bb
131,aftershock httpstcojv8ppkhjy7
132,aftershock back school kick great want thank everyone make possible great night
133,people say cannot do interrupt ûò george bernard shaw
134,first man get oyster second man get shell andrew carnegie
135,anyone need pu tonight play hybrid slayer ps4 eu hmu cod8sandscrims empirikgaming codawscrims 4tpkotc 4tpfa aftershockorg
136,expert france begin examine airplane debris find reunion island french air accident expert httptcoyvvpznzmxg news
137,strict liability context airplane accident pilot error common component aviation cr httptco6cz3bohrd4
138,crobscarla lifetime odds die airplane accident 1 8015
139,expert france begin examine airplane debris find reunion island french air accident expert wedn httptcobkpfpogysi
140,alexalltimelow awwww theyre airplane accident theyre gonna die cuties good job
141,family member osama bin laden die airplane accident ironic mhmmm gov shit suspect
142,man go airplane engine accident httptcotyjxrfd3st via youtube
143,horrible accident man die wing airplane 29072015 httptcoi7kztevb2v
144,cessna airplane accident ocampo coahuila mexico july 29 2015 kill four men include state coahuila government official
145,horrible accident man die wing airplane 29072015 watchthevideo httptcop64xrvgjik
146,expert france begin examine airplane debris find reunion island httptcolsmx2vwr3j french air accident expert wednesdayû
147,expert france begin examine airplane debris find reunion island french air accident expert wednesday begin examine
148,kca votejkt48id mbataweel rip binladen family member kill airplane accident
149,almost send coworker nude accident thank god airplane mode
150,mickinyman theatlantic might kill airplane accident night car wreck politics best
151,expert france begin examine airplane debris find reunion island french air accident expert httptcotagzbcxfj0 mlb
152,unbelievably insane man airport airplane aircraft aeroplane runway accident freakyû httpstcocezhq7czll
153,horrible accident man die wing airplaneåê29072015 httptcowq3wjsgphl
154,horrible accident man die wing airplane 29072015 httptcotfcdronra6
155,usama bin ladin family dead airplane crash naturally accident
156,pilot dy plane crash car festival httpstcokq9ae6ap2b via youtube crash aircraft airplane pilot death accident carfest
157,strict liability context airplane accident httptcogibyqhhkpk
158,dtn brazil expert france begin examine airplane debris find reunion island french air accident exp httptcom9ig3wq8lq
159,expert france begin examine airplane debris find reunion island french air accident expert wedn httptcov4smaeslk5
160,horrible accident man die wing ûïairplaneû 29072015 wtf canûªt believe eye ûò httptco6ffylajwps
161,nicole fletcher one victim crash airplane time ago accident leave little bit trauma although shes
162,omg horrible accident man die wing airplane httptcoxdxdprcpns
163,omg dont believe rip bro airplane accident jetengine turbojet boing g90 httptcokxxnszp6nk
164,expert france begin examine airplane debris find reunion island french air accident expert wednesday begin examine
165,airplane accident
166,phone look like car ship airplane accident terrible
167,statistically im risk get kill cop die airplane accident
168,airplane crash house colombia 12 people die accident httpstcozhjlflbhzl
169,shoot airplane accident httpstcoiecc1jdoub
170,could drone cause airplane accident pilot worry use drone esp close vicinity airport httptcokz35rgngjf
171,early wake call sister beg come amp ride wher ambulance hospital rodkiai
172,httptcoay6zzcupnz twelve fear kill pakistani air ambulance helicopter crash httptcosc9dns41mc
173,two air ambulance scene serious crash two car lorry httptco9pfeaqeski httptcofntg70rnkx emsneû
174,twelve fear kill pakistani air ambulance helicopter crash reuters httptcomdnugvubwn yugvani
175,lead emergency service boss welcome new ambulance charity httptcomj2jq2psv6
176,anyone travel aberystwythshrewsbury right there incident service halt outside shrews ambulance scene
177,twelve fear kill pakistani air ambulance helicopter crash httptcoxum8ylcb4q
178,ambulance sprinter automatic frontline vehicle choice 14 lez compliant ebay httptco4evttqpeia
179,new nanotech device able target destroy blood clot httptcohfy5v3slbb
180,20skyhawkmm20 traplord29 fredosantana300 lilreese300 hella crazy 3 fight ambulance couple mosh pit
181,get run ambulance lucky justsaying randomthought
182,news twelve fear kill pakistani air ambulance helicopter crash httptcobfes5twbzt tilnow dna
183,httptco7xglah10zl twelve fear kill pakistani air ambulance helicopter crash httptcothmblaatzp
184,tanslash wait ambulance
185,fouseytube ok need ambulance hahahah good httptcozsberqnn9n
186,ambulance sprinter automatic frontline vehicle choice 14 lez compliant ebay httptcoq8ivrzojzv
187,pakistan air ambulance helicopter crash kill nine httptco8e7ry8ebmf
188,thenissonian rejectdcartoons nissan ok need medical assistance call ambulance need
189,ems1 ny emts petition 17 per hour û÷minimum wageûª httptco4oa6swlxmr ems paramedic ambulance
190,httptcofcqmkffflw twelve fear kill pakistani air ambulance helicopter crash httptcovayaymbngu
191,twelve fear kill pakistani air ambulance helicopter crash httptco3brme6sn4t
192,ambulance sprinter automatic frontline vehicle choice 14 lez compliant ebay httptcoujrx9kgawp
193,ambulance sprinter automatic frontline vehicle choice 14 lez compliant ebay httptcokp2lf4aute
194,kiwikaryn check whats park lot say last year ambulance st john httptcohpvodud7ip
195,dont know way ambulance come ltlt
196,reuters twelve fear killed pakistani air ambulance helicopter crash httptcoshzpyiqok5
197,httptcopwwpum6rbj twelve fear kill pakistani air ambulance helicopter crash httptcoyspon4d6qo
198,ambulance right outside work
199,ûïleoblakecarter dog think he ambulance httptcomg1lpgr0rmûnatasharideout
200,happen hatzolah ems ambulance respond dual siren andû httpstcosek6mq6njf
201,httptcofuerk0gwui twelve fear kill pakistani air ambulance helicopter crash httptcomv7ggglmvc
202,httptcox5yeuylt1x twelve fear kill pakistani air ambulance helicopter crash httptco2ugrmd1z1n
203,twelve fear kill pakistani air ambulance helicopter crash httptcoth9ywbbeet worldnews
204,twelve fear kill pakistani air ambulance helicopter crash httptcox2qsjod40u worldnews
205,whats police ambulance number lesotho body know
206,medic914 aaceorg surprise still cannot standardised clinical practice across 11 nh ambulance trust
207,httptcoj8tyt1xrrk twelve fear kill pakistani air ambulance helicopter crash httptco9d4nazoi94
208,people try jwalk ambulance passing hate
209,episode trunk annihilate freiza cleanest shit ever show nigga mercy
210,shall annihilate petebests dessicated laid bare shall kneel
211,uribe annihilate baseball mets
212,marksmaponyane heysundowns annihilate previous meeting celticindeed improvement
213,volfan326 tneazzy mizzou annihilate florida past 2 season even end muschamps career cant compete bama
214,annihilate ab httptco1xpw292tje
215,annihilate status education mba behalf easy street careen eovm httptcoe0pi0c54ff
216,luka die everything annihilate alois trancy
217,acarewornheart good un fella sorry wont get annihilate
218,cop pull drink driver safety second car hit train httptcothrhkhogcuåê httptcotzszmf2qxe via viralspell
219,must annihilate
220,cop pull drink driver safety second car hit train httptcoc0nkgp6w03åê httptcoimwmfdjssn via viralspell
221,boom country entirely annihilate hû ûó britain httpstcoirfcn71szv
222,amirkingkhan would annihilate might well thank floydmayweather
223,one thing suregod promise israel annihilate butthe horror iran wnukes httpstcoxn09mx6sxy
224,violentfeminazi guess thats ok armenian since weve spent history get annihilate
225,70 year since annihilate 100000 people instantly become aware ability annihilate whole humanity
226,day 1 tryout go good minus fact stop quickly get short ball annihilate toenail injury even
227,1960s oryx symbol arabian peninsula annihilate hunter httptcoyangeqbuqw httptcojq2eh5kglt
228,luka die everything annihilate alois trancy
229,ready get annihilate bucs game
230,philipduncan breakfastone people annihilate last night weather really philip thought would forecast
231,domain sophistication annihilate closely uptotheminute feat zrnf
232,stormbeard steellord see judas priest 2005 rob come back scorpion support fuck annihilated place astonish gig
233,officially skip fantasticfourfant4sticwhatever hashtag get annihilate review bummer
234,tomcatarts thus explain annihilate case survivor evolve become godlike
235,completely annihilate cech paul keegan time alive
236,tomcatarts annihilate legion survivor imperfect hybrid project quickly form new secret cell
237,sirbrandonknt exactly thats lesnarcena match summerslam last year great brock annihilate guy who
238,cop pull drink driver safety second car hit train httptcof1bakpnyn6åê httptcolzxwoaye4x via viralspell
239,annihilate damascus syrian army grind û÷alloosh gang manure pile httptco7rakhp3bwm
240,thatdes ok wasnt completely forthright may also food coma bc kebabtahinipickles also annihilate wfries
241,fun fill happyhour simmons bar camden handsome one get annihilate apart game httptco4jno677zkv
242,juanny beisbol sr annihilate ball lgm
243,rvfriedmann hell fraction belief total annihilation destruction usa lodisilverado ritzyjewels
244,potus maybe call israel tell sorry pres sell river annihilation
245,evildead annihilation civilization httptcospfke5kqu4
246,us national park service tonto national forest stop annihilation salt river wild horse httptco6lojoorouk via change
247,annihilate quarterstaff annihilation
248,world annihilation vs self transformation httptcopyehwodwun alien attack exterminate human httptcopb2n77nskz
249,starmade stardate 3 planetary annihilation httptcoi2hhviumtm via youtube
250,us national park service tonto national forest stop annihilation salt river wild horse httpstcom8mvdspjp7 via change
251,us national park service tonto national forest stop annihilation salt river wild horse httpstcosw1sbua3mn via change
252,kimkardashian please sign share petition save wild horse arizona httptco3tssxphufe
253,us national park service tonto national forest stop annihilation salt river wild horse httptcokpqk0c4g0m via change
254,theellenshow please check salt river horse help stop annihilation happen without 54000 signatureschange org thx
255,soul punish withåêannihilation httptcoc1qxjweqqu httptcozhp0sowxry
256,calfreedommom steph93065 mention major contributor annihilation israel
257,willienelson need help horse dieplease rt amp sign petitiontake stand amp voice gilbert23 httpstcoe8dl1lncvu
258,reject law misguide false prophet imprison nation fuel self annihilation
259,us national park service tonto national forest stop annihilation salt river wild horse httpstcomatijwkzbh via change
260,annihilation jeb christie amp kasich less 24 hour away please god allow least one full day
261,barbitwins need helphorses die please rt amp sign petition take stand amp voice gilbert23 httpstcoe8dl1lncvu
262,whippenz need help horse dieplease rt amp sign petitiontake stand amp voice gilbert23 httpstcoe8dl1lncvu
263,hey az sign petition save wildhorses tantonationalforest rollingstones singalong order httptcowm5l8pj2iy
264,stop annihilation salt river wild horse httptcowvobvvtxkg via change
265,sonofbaldwin he current nova bookslast checkedhe tie book 2011 rider die annihilation
266,us national park service tonto national forest stop annihilation salt river wild horse httpstcox2wn7o2a3w via change
267,please sign amp rt save saltriverwildhorses httptcoikuayuseqt httptcobqbhuyfme9
268,thanks count dante join us follow annihilation zone johnny
269,world annihilation vs self transformation httptcopyehwodwun alien attack exterminate human httptco8jxql8cv8z
270,us national park service tonto national forest stop annihilation salt river wild horse httpstco0fekgyby5f via change
271,us national park service tonto national forest stop annihilation salt river wild horse httptcosb5r7shccj via change
272,im gonna fight taylor soon get
273,ohh fukurodani didnt survive apocalypse bokuto feel horrible poor boy ppor child
274,another jocelyn birthday apocalypse
275,rt janenelson097 rt stephenscifi adaptation watch charlie human apocalypse optioned film sciencefiction û
276,apocalypse please
277,another hour august 05 2015 0802pm here red rover zombie apocalypse 2014 httptcocf9e6tu3g7 internetradio collegeradiû
278,honeybunzgem primalkitchen feel like pullup one stag apocalypse
279,shes kinda hot play radio today whats next disease apocalypse start everyone careful
280,apocalypse lol gf m8
281,know question interpretation sign apocalypse call httpstcomy8q1uwijn
282,julie r apocalypse version romeo juliet warmbodies
283,apocalypse upon us
284,rt fittscott minecraft night lucky block mod bob apocalypse wither 20 amp mod showcase popularmmos httptcomul1j9aeux viû
285,begin day one snow apocalypse
286,rt ourmothermary short reading apocalypse 211023 spirit angel take top enormous high mountain û
287,candylit imagine sarumi zombie apocalypse fight back back heart heart conversation httptcoxizkjfff29
288,rt zonewolf123 like youtube video httptcou66kyg11zd minecraft night lucky block mod bob apocalypse wither 20 amp moû
289,thats planet lone audience apocalypse
290,dad buy dvd look like science doc front read back actually impend biblical apocalypse
291,alexandrapullin indeed apocalypse come week know ill
292,go look grizzly peak right look like begin dystopian apocalypse movie
293,niece ask would scar apocalypse
294,there storm cairo late xmen apocalypse set photo httpstcofs012trudg via yahootv
295,minecraft night lucky block mod bob apocalypse wither 20 amp mod showcase popularmmos httptcotngye2fklv via youtube
296,shot heart xv go totally give love bad name heart pierc httptcoxpfmr368uf httptcoejdhvlkxaf
297,rt geekapocalypse 4pm gmt hesse play dark soul 2 day 9 httptcotngpshnl87 httptcoimzlnzltf5 etcpb
298,know go zombie take httptcohuthxlkyxy
299,late bryansinger reveals storm queen apocalypse rupaul alexshipppp httptcooqw8jx6rts
300,shadow boxing apocalypse
301,short reading apocalypse 211023 spirit angel take top enormous high mountain httptcov8aftd9zez
302,enjoy liveaction attack titan every time see poster im remind freshly clean coiffed everyone apocalypse
303,like youtube video httptcoki1ykrs9fi minecraft night lucky block mod bob apocalypse wither 20 amp mod showcase
304,pbban temporary300 avysss armageddon kill flag fast xp reason
305,pbban temporary300 russaky89 armageddon kill flag fast xp reason
306,official vid doublecups gtgt httpstcolfkmtzaekk gtgt trubgme prod thisizbwright gtgt armageddon
307,ouvindo peace love amp armageddon
308,best movie youve ever see armageddon httptcoqouxigdtbz
309,bed time dont wake unless revolution armageddon start
310,red faction armageddon microsoft xbox 360 2011 full read ebay httptcoypbvs1ijya httptco9dflv6ynqr
311,katiekatcubs already know shit go world series armageddon
312,rt ophiuchus2613 love truelove romance lith voodoo seduction astrology rtrrt lotz 911 apocalypse armageddon 1008plaû
313,im gonna beat armageddon hsu hao get flawless first try
314,enews ben afflecki know there wifekids girl cant help ive love since armageddon eonlinechat
315,id long coat hand id worn certainty armageddon bear sense occasion
316,phone spy hide back door nsa data mining software financial armageddon blog httptcoqycw5jjaj1
317,pbban temporary300 hyiderghost2 armageddon kill flag fast xp reason
318,rt rtrrtcoach love truelove romance lith voodoo seduction astrology rtrrt lotz 911 apocalypse armageddon 1008planetû
319,pbban temporary300 fighterdena armageddon kill flag fast xp reason
320,photo sketch base taste armageddon episode startrek tos httptcoa2e6dcsk88
321,armageddon httpstcoucsudk3q1d
322,aberdeenfc aberdeenfanpage good luck tomorrow night get coefficient point plz armageddon
323,paddytomlinson1 armageddon
324,rohnertparkdps youre another one history book thank justice department way havent pay income tax 20yrs
325,vladimir putin issue major warn late escape armageddon httptcogbxafy1m1c
326,god kingdom heavenly govt rule people earth armageddon httptco8hgcbxukz0 httptco4kopkcyvtt
327,l b entertainment lot 8 brucewillis movie dvd die hard 1 2 12 monkey armageddon sixth ebay auction httptcocxdjapzxmp
328,letûªs talk goof guild saunders come right stage httpstcohkbxxvd9iw
329,karnythia niece gain ability stand im get prepared toddler apocalypse armageddon
330,check preppers doomsday must library collection cd shtf preppertalk survival 2a prepper httptcovpqtgeqlma via ebay
331,erker eep think yesterday saw hella scary hail armageddon
332,ahamedis think messiah already come 125 year ago armageddon dajaal gog amp magog
333,sadly windows 10 reveals microsofts ethic armageddon httptcostftjcrjea
334,armageddon avert el patron ultimalucha
335,samihonkonen time 23 hour late series ww1 blueprint armageddon extremely impressive
336,european fitba till christmas armageddon
337,christian unite israel cufi jew convert soon die armageddon httpstco4arwwrzpsr us httptcomkjq9yfmp8
